{"run":128,"commit":"e525e7f","metric":0,"metrics":{},"status":"keep","description":"Add local bash -n coverage for the documented czu/czuf/czl/czm/czb/czvc wrappers and chezmoi-rerun-script so autoresearch.checks.sh validates the user-facing managed commands too.","timestamp":1776649537324,"segment":64,"confidence":null,"iterationTokens":1010,"asi":{"hypothesis":"The documented managed maintenance commands can be guarded locally with the same straightforward bash -n coverage CI already uses.","insight":"This extends the safety net from internal helpers to the actual user-facing entrypoints people run day to day, which is a worthwhile symmetry improvement for low cost.","scope":"Touched only autoresearch.checks.sh.","validation":"The targeted audit cleared and the updated autoresearch checks still completed comfortably within the existing budget.","best_practice":"When a repo documents a small set of wrapper commands as first-class workflows, include their source entrypoints in the lightweight local syntax checks so changes to day-to-day commands are caught before they reach apply-time use."}}
{"type":"config","name":"Direct managed command check audit","metricName":"issue_count","metricUnit":"","bestDirection":"lower"}
{"run":129,"commit":"e525e7f","metric":2,"metrics":{},"status":"discard","description":"Baseline for direct managed-command local coverage found two local-validation omissions: autoresearch.checks.sh still skips the direct chezmoi-bump and chezmoi-check-versions entrypoints.","timestamp":1776649706643,"segment":65,"confidence":null,"iterationTokens":99,"asi":{"hypothesis":"After covering the documented wrapper commands, the next adjacent local/CI symmetry gap is the two direct managed maintenance commands that the repo also surfaces explicitly.","rollback_reason":"Baseline only; no repo changes beyond autoresearch scaffolding should be kept from this run.","next_action_hint":"Add bash -n checks for dot_local/bin/executable_chezmoi-bump and dot_local/bin/executable_chezmoi-check-versions to autoresearch.checks.sh.","insight":"This is the narrowest remaining user-facing command gap in the current local safety net: the wrappers are covered, but the underlying direct commands still are not."}}
{"run":130,"commit":"9cab7c9","metric":0,"metrics":{},"status":"keep","description":"Add local bash -n coverage for the direct chezmoi-bump and chezmoi-check-versions entrypoints so autoresearch.checks.sh validates the remaining user-facing managed commands too.","timestamp":1776649734214,"segment":65,"confidence":null,"iterationTokens":806,"asi":{"hypothesis":"The last two direct maintenance commands can be covered locally with the same straightforward bash -n pattern already used for the wrapper commands.","insight":"This closes the remaining user-facing command gap cleanly: both wrapper commands and their direct managed counterparts now inherit the same local syntax guardrails.","scope":"Touched only autoresearch.checks.sh.","validation":"The targeted audit cleared and the updated autoresearch checks still completed comfortably within the existing budget.","best_practice":"If a repo exposes both wrapper commands and direct managed command entrypoints for the same workflow family, syntax-check both layers locally so user-facing maintenance changes are covered regardless of which interface someone runs."}}
{"type":"config","name":"Pi maintenance-agent shell entrypoint audit","metricName":"issue_count","metricUnit":"","bestDirection":"lower"}
{"run":131,"commit":"9cab7c9","metric":2,"metrics":{},"status":"discard","description":"Baseline for Pi maintenance-agent local shell coverage found two local-validation omissions: autoresearch.checks.sh still skips the run-maintenance and git-ssh entrypoints used by the scheduled Pi maintenance flow.","timestamp":1776649813254,"segment":66,"confidence":null,"iterationTokens":101,"asi":{"hypothesis":"After covering the user-facing managed commands, the next adjacent local/CI symmetry gap is the Pi maintenance-agent entrypoint pair that CI already syntax-checks and the maintenance-agent README documents.","rollback_reason":"Baseline only; no repo changes beyond autoresearch scaffolding should be kept from this run.","next_action_hint":"Add bash -n checks for dot_local/share/pi-maintenance-agent/bin/executable_git-ssh.sh and executable_run-maintenance.sh to autoresearch.checks.sh.","insight":"This is a concrete integration-surface gap rather than generic coverage hunting: run-maintenance.sh is the documented scheduled entrypoint and it explicitly depends on the git-ssh helper."}}
{"run":132,"commit":"2e91856","metric":0,"metrics":{},"status":"keep","description":"Add local bash -n coverage for the Pi maintenance agent's run-maintenance and git-ssh entrypoints so autoresearch.checks.sh validates the scheduled maintenance flow's shell surfaces too.","timestamp":1776649836368,"segment":66,"confidence":null,"iterationTokens":823,"asi":{"hypothesis":"The maintenance-agent integration pair can be covered locally with the same direct bash -n checks CI already uses.","insight":"This extends the local safety net into one more real integration surface: the documented scheduled entrypoint and the helper it wires in through GIT_SSH_COMMAND now get checked together.","scope":"Touched only autoresearch.checks.sh.","validation":"The targeted audit cleared and the updated autoresearch checks still completed comfortably within the existing budget.","best_practice":"When one maintained shell entrypoint explicitly dispatches through a small helper script, syntax-check both together in the local safety net so integration changes cannot regress the helper silently."}}
{"type":"config","name":"Remaining top-level bin shell entrypoint audit","metricName":"issue_count","metricUnit":"","bestDirection":"lower"}
{"run":133,"commit":"2e91856","metric":2,"metrics":{},"status":"discard","description":"Baseline for the remaining top-level local bin shell coverage found two local-validation omissions: autoresearch.checks.sh still skips the Omarchy screenshot helper and the tmux-status-host script.","timestamp":1776649953321,"segment":67,"confidence":null,"iterationTokens":102,"asi":{"hypothesis":"After covering the user-facing and maintenance-agent shell entrypoints, the final top-level local/CI symmetry gap is the last two dot_local/bin shell scripts CI still checks but autoresearch does not.","rollback_reason":"Baseline only; no repo changes beyond autoresearch scaffolding should be kept from this run.","next_action_hint":"Add bash -n for dot_local/bin/executable_omarchy-screenshot-active-window-clipboard and sh -n for dot_local/bin/executable_tmux-status-host to autoresearch.checks.sh.","insight":"This is bounded and evidence-backed: these are the final top-level shell entrypoints still outside the local safety net, and the screenshot helper is wired into managed Hypr bindings."}}
{"run":134,"commit":"6b6c27e","metric":0,"metrics":{},"status":"keep","description":"Add local syntax checks for the final two top-level dot_local/bin shell entrypoints so autoresearch.checks.sh now covers the Omarchy screenshot helper and tmux-status-host too.","timestamp":1776649981584,"segment":67,"confidence":null,"iterationTokens":770,"asi":{"hypothesis":"The last two top-level bin scripts can be pulled into the local safety net with the same shell-specific syntax checks CI already uses.","insight":"This finishes the top-level bin symmetry pass cleanly: local autoresearch now checks every shell entrypoint CI was already treating as part of that surface.","scope":"Touched only autoresearch.checks.sh.","validation":"The targeted audit cleared and the updated autoresearch checks still completed comfortably within the existing budget.","best_practice":"When finishing a bounded syntax-coverage sweep, match each entrypoint's real interpreter (`bash` vs `sh`) so the local safety net tests the same grammar the script will actually run under."}}
{"type":"config","name":"Tailscale setup-template check audit","metricName":"issue_count","metricUnit":"","bestDirection":"lower"}
{"run":135,"commit":"6b6c27e","metric":1,"metrics":{},"status":"discard","description":"Baseline for Tailscale setup-template local coverage found one remaining omission: autoresearch.checks.sh still skips the script-maintainer skill's cited Tailscale trust-gate example template.","timestamp":1776650092428,"segment":68,"confidence":null,"iterationTokens":101,"asi":{"hypothesis":"After covering the other high-leverage setup templates, the next adjacent skill-guidance gap is the cited Tailscale installer trust-gate template.","rollback_reason":"Baseline only; no repo changes beyond autoresearch scaffolding should be kept from this run.","next_action_hint":"Add chezmoi execute-template < .chezmoiscripts/run_onchange_after_37-setup-tailscale.sh.tmpl | bash -n to autoresearch.checks.sh.","insight":"This is a narrowly scoped skill-alignment improvement: the script-maintainer references already single out this template as an example worth studying, so local syntax coverage is a reasonable follow-through."}}
{"run":136,"commit":"8c63ea9","metric":0,"metrics":{},"status":"keep","description":"Add local render/parse coverage for the Tailscale setup template so autoresearch.checks.sh also validates the script-maintainer skill's cited trust-gate example.","timestamp":1776650123272,"segment":68,"confidence":null,"iterationTokens":807,"asi":{"hypothesis":"The remaining skill-guidance gap can be closed with one more execute-template | bash -n check for the Tailscale setup template.","insight":"This was a neat follow-through on the script-maintainer references: once a template is called out as a canonical installer trust-gate example, local syntax coverage is low-cost and high-leverage.","scope":"Touched only autoresearch.checks.sh.","validation":"The targeted audit cleared and the updated autoresearch checks still completed comfortably within the existing budget.","best_practice":"When maintainer guidance singles out a template as a canonical trust-gate example, include it in the lightweight local render-and-parse checks so future edits inherit that same scrutiny."}}
{"type":"config","name":"Prefetch-assets template check audit","metricName":"issue_count","metricUnit":"","bestDirection":"lower"}
{"run":137,"commit":"8c63ea9","metric":1,"metrics":{},"status":"discard","description":"Baseline for prefetch-assets template local coverage found one docs-driven omission: autoresearch.checks.sh still skips the optional prefetch-assets template documented in architecture-and-performance notes.","timestamp":1776650368630,"segment":69,"confidence":null,"iterationTokens":100,"asi":{"hypothesis":"After covering the Tailscale trust-gate template, the next adjacent docs-alignment gap is the optional prefetch-assets template explicitly called out in docs/architecture-and-performance.md.","rollback_reason":"Baseline only; no repo changes beyond autoresearch scaffolding should be kept from this run.","next_action_hint":"Add chezmoi execute-template < .chezmoiscripts/run_onchange_before_02-prefetch-assets.sh.tmpl | bash -n to autoresearch.checks.sh.","insight":"This is narrowly scoped and principled: the template is already documented as part of the repo's architecture/performance model, so local syntax coverage is a reasonable follow-through."}}
{"run":138,"commit":"c19de40","metric":0,"metrics":{},"status":"keep","description":"Add local render/parse coverage for the optional prefetch-assets template so autoresearch.checks.sh also validates the architecture/performance docs' cited prefetch path.","timestamp":1776650398408,"segment":69,"confidence":null,"iterationTokens":736,"asi":{"hypothesis":"The optional prefetch-assets template can be covered locally with one more execute-template | bash -n check, keeping docs and validation aligned.","insight":"This was another clean docs-to-validation follow-through: once the template is called out as part of the repo's architecture/performance model, local syntax coverage is low-cost and justified.","scope":"Touched only autoresearch.checks.sh.","validation":"The targeted audit cleared and the updated autoresearch checks still completed comfortably within the existing budget.","best_practice":"When architecture/performance docs explicitly call out a managed template as part of the system design, include it in the lightweight local render-and-parse checks so future edits inherit the same scrutiny."}}
{"type":"config","name":"Remaining apply-time script check audit","metricName":"issue_count","metricUnit":"","bestDirection":"lower"}
{"run":139,"commit":"c19de40","metric":8,"metrics":{},"status":"discard","description":"Baseline for the remaining apply-time script local coverage found eight syntax-check omissions: autoresearch.checks.sh still skips the residual unchecked scripts under .chezmoiscripts/.","timestamp":1776650484384,"segment":70,"confidence":null,"iterationTokens":100,"asi":{"hypothesis":"After covering the highest-leverage documented templates and command entrypoints, the remaining bounded local safety-net gap is the final residual set of apply-time scripts under .chezmoiscripts/.","rollback_reason":"Baseline only; no repo changes beyond autoresearch scaffolding should be kept from this run.","next_action_hint":"Add direct bash -n checks for the non-templated scripts and execute-template | bash -n checks for the remaining templated scripts in .chezmoiscripts/.","insight":"This is now a bounded high-impact surface completion pass rather than open-ended coverage hunting: AGENTS.md already treats .chezmoiscripts/ as a single important subsystem, and only a small residual set remains unchecked."}}
{"run":140,"commit":"d6a00ec","metric":0,"metrics":{},"status":"keep","description":"Finish the local .chezmoiscripts syntax-coverage sweep by adding the remaining unchecked apply-time scripts to autoresearch.checks.sh.","timestamp":1776650539102,"segment":70,"confidence":null,"iterationTokens":2704,"asi":{"hypothesis":"The final residual apply-time scripts under .chezmoiscripts/ can be covered locally with straightforward bash -n or execute-template | bash -n checks, completing the high-impact surface sweep.","insight":"This completes a bounded validation pass cleanly: the local safety net now checks the full apply-time script surface instead of only a selected subset of scripts and templates.","scope":"Touched only autoresearch.checks.sh.","validation":"The targeted audit cleared and the expanded autoresearch checks still completed comfortably within the existing budget.","best_practice":"When a repo treats an entire apply-time script directory as a high-impact surface, finish bounded syntax coverage of the whole directory once the residual unchecked set is small and verified safe to parse."}}
{"type":"config","name":"autoresearch.checks runtime benchmark","metricName":"total_ms","metricUnit":"ms","bestDirection":"lower"}
{"run":141,"commit":"d6a00ec","metric":10815.51,"metrics":{},"status":"discard","description":"Baseline runtime benchmark for the fully widened autoresearch.checks.sh measured about 10.8s total over 5 runs (~2163ms per run) before any structural speedup.","timestamp":1776650725230,"segment":71,"confidence":null,"iterationTokens":747,"asi":{"hypothesis":"Now that the local safety net covers most high-impact surfaces, the next promising optimization is reducing autoresearch.checks.sh runtime via structure-only changes that keep coverage intact.","rollback_reason":"Baseline only; no repo changes beyond autoresearch scaffolding should be kept from this run.","next_action_hint":"Try grouping independent read-only checks into a few parallel batches while keeping the temp-home/tmux validation path serialized.","insight":"The broader safety net is now materially more expensive than earlier segments, so runtime optimization is worthwhile if it can avoid semantic changes or coverage loss."}}
{"run":142,"commit":"276d9b5","metric":7892.36,"metrics":{},"status":"keep","description":"Speed up autoresearch.checks.sh by running independent render/parse, source-syntax, and templated-script checks in three parallel batches while keeping the tmux/temp-home validation path serialized.","timestamp":1776650831001,"segment":71,"confidence":null,"iterationTokens":4191,"asi":{"hypothesis":"Most of autoresearch.checks.sh is read-only and independent, so grouping it into a few parallel batches should cut wall-clock time without weakening coverage or reintroducing drift-sensitive behavior.","insight":"Coarse-grained batching was enough for a real win: three parallel groups preserved readability and semantics while cutting runtime from about 10.8s to 7.9s over 5 runs.","scope":"Touched only autoresearch.checks.sh.","validation":"The runtime benchmark improved materially and the updated autoresearch checks still passed cleanly under the normal backpressure run.","best_practice":"When a broadened local safety net becomes expensive, prefer a small number of coarse parallel batches of independent read-only checks over many fine-grained background jobs so you improve runtime without making the script hard to reason about."}}
{"run":143,"commit":"63934a9","metric":4650.53,"metrics":{},"status":"keep","description":"Further speed up autoresearch.checks.sh by running the tmux/temp-home validation path in parallel with the other read-only batches, cutting the 5-run benchmark to about 4.65s total (~930ms per run).","timestamp":1776650897902,"segment":71,"confidence":2.109019379778663,"iterationTokens":3860,"asi":{"hypothesis":"The remaining stateful tmux/temp-home validation path is independent of the other batches, so moving it into its own parallel group should further reduce wall-clock time without changing semantics.","insight":"The serialized tail was a major share of residual runtime. Parallelizing it alongside the existing render/source/template batches yielded another large win while keeping each batch internally simple.","scope":"Touched only autoresearch.checks.sh.","validation":"The runtime benchmark improved materially again and the updated autoresearch checks still passed cleanly under the normal backpressure run.","best_practice":"After coarse-grained parallelization, look for remaining independent serialized tails; moving a whole stateful-but-self-contained tail into its own batch can deliver another substantial speedup without fragmenting the script into too many jobs."}}
{"run":144,"commit":"63934a9","metric":4761.83,"metrics":{},"status":"discard","description":"Tried splitting the templated-script batch into two smaller parallel groups, but a confirming rerun showed the apparent gain was within noise versus the existing 4-batch design, so the extra concurrency complexity was not kept.","timestamp":1776651006275,"segment":71,"confidence":3.80339499603619,"iterationTokens":365,"asi":{"hypothesis":"After parallelizing the stateful tail, splitting the template batch again might reduce the remaining wall-clock bottleneck.","rollback_reason":"Two reruns landed on opposite sides of the previous best (~4468ms and ~4762ms versus ~4651ms), which makes the extra batching complexity look like noise rather than a reliable improvement.","next_action_hint":"If pursuing more runtime wins, measure group-level bottlenecks first or try lower-complexity batching changes such as parser consolidation rather than adding more concurrent groups.","insight":"The coarse 4-batch structure already captures most of the real win; making the template side more granular did not produce a stable improvement.","measurements":"first rerun total_ms=4468.24, confirming rerun total_ms=4761.83, prior kept design total_ms=4650.53"}}
{"type":"config","name":"Generic Claude allowlist drift-guard audit","metricName":"issue_count","metricUnit":"","bestDirection":"lower"}
{"run":145,"commit":"63934a9","metric":2,"metrics":{},"status":"discard","description":"Baseline for generic Claude allowlist drift guards found two remaining health-check gaps: it still lacks parser-based warnings for unexpected repo-local Bash permissions and unexpected WebFetch domains.","timestamp":1776651110548,"segment":72,"confidence":null,"iterationTokens":102,"asi":{"hypothesis":"Now that the easy stale Claude permission entries are gone, the next low-risk safety win is a generic drift guard in chezmoi-health-check rather than another speculative permission removal.","rollback_reason":"Baseline only; no repo changes beyond autoresearch scaffolding should be kept from this run.","next_action_hint":"Add one parser-based check for unexpected Bash(...) allowlist entries and one for unexpected WebFetch(domain:...) entries in .claude/settings.local.json, then consider pruning the stale remaining Claude-permission idea.","insight":"This shifts the Claude-permission work from reactive one-off grep warnings toward a stable allowlist contract that can catch future broadening without guessing which current core permission to remove."}}
