{"run":110,"commit":"66c1bfb","metric":4,"metrics":{},"status":"discard","description":"Baseline for managed agent settings check coverage found four local-validation omissions: autoresearch.checks.sh still skips the managed Claude/Pi settings JSON sources and their rendered dry-run targets.","timestamp":1776647614805,"segment":55,"confidence":null,"iterationTokens":115,"asi":{"hypothesis":"After covering repo-local Claude policy JSON, Codex TOML, externals, and version-data TOML, the next adjacent low-risk validation win is managed Claude/Pi settings coverage in autoresearch.checks.sh.","rollback_reason":"Baseline only; no repo changes beyond autoresearch scaffolding should be kept from this run.","next_action_hint":"Add JSON parse checks for private_dot_claude/settings.json and dot_pi/agent/settings.json plus dry-run targets for ~/.claude/settings.json and ~/.pi/agent/settings.json in autoresearch.checks.sh.","insight":"This is a focused agent-config validation gap rather than generic coverage hunting: the repo already tracks these settings and one of them was just edited manually in normal work."}}
{"run":111,"commit":"66e32c0","metric":0,"metrics":{},"status":"keep","description":"Add managed Claude/Pi settings coverage to autoresearch.checks.sh so the local safety net parses both JSON sources and dry-runs their rendered targets too.","timestamp":1776647644634,"segment":55,"confidence":null,"iterationTokens":1890,"asi":{"hypothesis":"A tiny expansion of autoresearch.checks.sh can close the remaining managed agent-settings validation gap by parsing the Claude/Pi JSON sources and dry-running their rendered targets.","insight":"This complements the earlier repo-local Claude policy JSON and Codex TOML checks nicely: the lightweight local safety net now covers the repo-managed Claude and Pi settings surfaces too.","scope":"Touched only autoresearch.checks.sh.","validation":"The targeted audit cleared and the expanded autoresearch checks still completed comfortably within the existing budget.","best_practice":"When a repo tracks managed agent settings in source form, parse those source files and dry-run their rendered targets in the lightweight safety net so routine config edits inherit basic validation by default."}}
{"type":"config","name":"Agent setup-template check audit","metricName":"issue_count","metricUnit":"","bestDirection":"lower"}
{"run":112,"commit":"66e32c0","metric":3,"metrics":{},"status":"discard","description":"Baseline for agent setup-template check coverage found three local-validation omissions: autoresearch.checks.sh still skips the managed Claude Code, Pi CLI, and Codex setup templates.","timestamp":1776647750673,"segment":56,"confidence":null,"iterationTokens":99,"asi":{"hypothesis":"After covering managed agent settings JSON surfaces, the next adjacent low-risk validation win is to parse the tracked agent-tool setup templates in autoresearch.checks.sh.","rollback_reason":"Baseline only; no repo changes beyond autoresearch scaffolding should be kept from this run.","next_action_hint":"Add chezmoi execute-template ... | bash -n lines for the Claude Code, Pi CLI, and Codex setup templates in autoresearch.checks.sh.","insight":"This is a focused script-validation gap rather than generic coverage hunting because these templates provision tracked agent tooling and the script-maintainer references already cite the Claude/Codex setup paths as canonical examples."}}
{"run":113,"commit":"08977f8","metric":0,"metrics":{},"status":"keep","description":"Add the Claude Code, Pi CLI, and Codex setup templates to autoresearch.checks.sh so the local safety net parses the managed agent-tool installer templates too.","timestamp":1776647776162,"segment":56,"confidence":null,"iterationTokens":1031,"asi":{"hypothesis":"A small template-parse expansion can close the remaining managed agent-tool setup gap in autoresearch.checks.sh without changing runtime behavior.","insight":"This complements the earlier config-surface checks: the lightweight local safety net now covers both managed agent settings files and the setup templates that provision those tools.","scope":"Touched only autoresearch.checks.sh.","validation":"The targeted audit cleared and the expanded autoresearch checks still completed comfortably within the existing budget.","best_practice":"If a repo treats a small set of agent-tool installer templates as maintained first-class setup paths, include them in the lightweight render-and-parse safety net so routine experiments catch syntax drift before apply-time execution."}}
{"type":"config","name":"Pi keybindings check audit","metricName":"issue_count","metricUnit":"","bestDirection":"lower"}
{"run":114,"commit":"08977f8","metric":2,"metrics":{},"status":"discard","description":"Baseline for Pi keybindings check coverage found two local-validation omissions: autoresearch.checks.sh still skips the managed Pi keybindings JSON source and its rendered target.","timestamp":1776647858907,"segment":57,"confidence":null,"iterationTokens":99,"asi":{"hypothesis":"After covering the managed Pi settings JSON file, the next adjacent low-risk validation win is to add the sibling Pi keybindings JSON source and rendered target to autoresearch.checks.sh.","rollback_reason":"Baseline only; no repo changes beyond autoresearch scaffolding should be kept from this run.","next_action_hint":"Add a JSON parse for dot_pi/agent/keybindings.json and a dry-run target for ~/.pi/agent/keybindings.json in autoresearch.checks.sh.","insight":"This is a narrow but principled symmetry gap: the repo now validates Pi settings but still omits the sibling keybindings file from the same managed config surface."}}
{"run":115,"commit":"08977f8","metric":0,"metrics":{},"status":"checks_failed","description":"Adding ~/.pi/agent/keybindings.json to the dry-run target list cleared the audit metric, but autoresearch.checks.sh then hung until timeout because chezmoi apply --dry-run hit local keybindings drift and waited on an interactive prompt.","timestamp":1776648196133,"segment":57,"confidence":null,"iterationTokens":906,"asi":{"hypothesis":"The Pi keybindings gap might close the same way as the Pi settings gap by adding one JSON parse and one dry-run target to autoresearch.checks.sh.","rollback_reason":"The rendered-target dry-run is not loop-safe on this machine because ~/.pi/agent/keybindings.json currently has local drift, so chezmoi apply --dry-run waits for interactive overwrite confirmation and times out under checks.","next_action_hint":"Avoid keyed dry-run validation for this path; either switch the audit to source-JSON coverage only or validate the rendered content through a non-interactive render path instead of chezmoi apply --dry-run.","insight":"This uncovered a useful distinction between managed settings.json and keybindings.json: the latter currently has local drift, so target-specific dry-run checks can deadlock even when the source file itself is valid.","error_detail":"autoresearch.checks.sh timed out after 300s with no useful stderr because chezmoi was waiting for prompt input."}}
{"type":"config","name":"Pi keybindings render-safe check audit","metricName":"issue_count","metricUnit":"","bestDirection":"lower"}
{"run":116,"commit":"088ea86","metric":0,"metrics":{},"status":"keep","description":"Replace the Pi keybindings dry-run check with a non-interactive chezmoi cat + JSON parse, keeping keybindings coverage while avoiding local-drift prompt hangs in autoresearch.checks.sh.","timestamp":1776648618881,"segment":58,"confidence":null,"iterationTokens":1903,"asi":{"hypothesis":"Pi keybindings can stay in the lightweight safety net if the rendered target is validated through a non-interactive render path instead of chezmoi apply --dry-run.","insight":"The right fix was not to drop keybindings coverage, but to swap validation mechanisms: chezmoi cat preserves rendered-target coverage without inheriting apply-time prompt behavior from local drift.","scope":"Touched only autoresearch.checks.sh.","validation":"The refined audit cleared and the updated autoresearch checks passed quickly without hanging on local ~/.pi/agent/keybindings.json drift.","best_practice":"When target-specific chezmoi apply --dry-run checks can hit interactive overwrite prompts from local drift, prefer a non-interactive render path such as chezmoi cat or execute-template plus a format parser so the safety net remains loop-safe."}}
{"type":"config","name":"Render-safe managed JSON target check audit","metricName":"issue_count","metricUnit":"","bestDirection":"lower"}
{"run":117,"commit":"088ea86","metric":2,"metrics":{},"status":"discard","description":"Baseline for render-safe managed JSON target checks found two remaining interactive-prone validations: autoresearch.checks.sh still uses apply-time dry-run paths instead of non-interactive render checks for the Claude and Pi settings targets.","timestamp":1776648699965,"segment":59,"confidence":null,"iterationTokens":101,"asi":{"hypothesis":"After learning that apply-time dry-run can hang on drifted JSON targets, the next low-risk robustness win is to switch the remaining managed JSON targets to chezmoi cat + JSON parse validation.","rollback_reason":"Baseline only; no repo changes beyond autoresearch scaffolding should be kept from this run.","next_action_hint":"Add non-interactive chezmoi cat + JSON parse checks for ~/.claude/settings.json and ~/.pi/agent/settings.json, and remove those targets from the apply --dry-run list.","insight":"The keybindings failure generalizes: any drifted managed JSON target can make apply-time validation less loop-safe than a direct rendered-content parse."}}
{"run":118,"commit":"400708f","metric":0,"metrics":{},"status":"keep","description":"Switch the Claude and Pi settings target checks to chezmoi cat + JSON parsing, removing apply-time dry-run prompts from the remaining managed JSON validations in autoresearch.checks.sh.","timestamp":1776648727794,"segment":59,"confidence":null,"iterationTokens":1094,"asi":{"hypothesis":"The remaining managed JSON targets can use the same non-interactive render-safe validation pattern as Pi keybindings without losing useful coverage.","insight":"This change generalizes the keybindings lesson into a cleaner rule: use apply-time dry-run for rendered file existence/routing checks, but prefer chezmoi cat + format parsing for drift-prone managed JSON targets.","scope":"Touched only autoresearch.checks.sh.","validation":"The refined audit cleared and the updated autoresearch checks still completed comfortably within the existing budget.","best_practice":"For managed JSON targets, validate rendered content through chezmoi cat plus a JSON parser rather than apply-time dry-run so local drift cannot turn the safety net into an interactive prompt."}}
{"type":"config","name":"Render-safe remaining target coverage audit","metricName":"issue_count","metricUnit":"","bestDirection":"lower"}
{"run":119,"commit":"400708f","metric":9,"metrics":{},"status":"discard","description":"Baseline for render-safe remaining target coverage found nine local-validation omissions: the remaining Codex config/AGENTS, skill metadata YAML, and rendered health-check targets still rely on apply-time validation and lack non-interactive render-safe checks.","timestamp":1776648925546,"segment":60,"confidence":null,"iterationTokens":100,"asi":{"hypothesis":"After converting the managed JSON targets, the next robustness win is to replace the last apply-time target checks with non-interactive chezmoi cat + format-aware validation.","rollback_reason":"Baseline only; no repo changes beyond autoresearch scaffolding should be kept from this run.","next_action_hint":"Add render-safe checks for ~/.codex/config.toml, ~/.codex/AGENTS.md, the five rendered skill metadata YAML files, and ~/.local/bin/chezmoi-health-check, then remove the final chezmoi apply --dry-run block.","insight":"The audit confirms the pattern is now broader than JSON: the only remaining interactive-prone checks are a small, finite set of Codex/YAML/script targets that all have direct non-interactive render paths."}}
{"run":120,"commit":"493e3ca","metric":0,"metrics":{},"status":"keep","description":"Replace the remaining apply-time target checks in autoresearch.checks.sh with render-safe Codex/TOML, AGENTS, YAML, and rendered health-check validation, and prune stale resolved notes from autoresearch.ideas.md.","timestamp":1776648989927,"segment":60,"confidence":null,"iterationTokens":2061,"asi":{"hypothesis":"The last apply-time validation block can be removed entirely by switching the remaining managed targets to chezmoi cat plus format-aware parsing, making the loop more robust against local drift prompts.","insight":"The render-safe pattern now generalizes cleanly across the remaining target types: TOML via tomllib, YAML via Ruby's safe_load, scripts via bash -n, and plain rendered Markdown via chezmoi cat to /dev/null.","scope":"Touched autoresearch.checks.sh and pruned stale resolved notes from autoresearch.ideas.md.","validation":"The targeted audit cleared and the expanded autoresearch checks still completed comfortably within the existing budget.","best_practice":"When lightweight validation only needs rendered content to exist and parse, prefer non-interactive chezmoi cat plus a format-aware parser over apply-time dry-runs so local drift cannot deadlock the experiment loop."}}
{"type":"config","name":"Shell/tmux rendered-config check audit","metricName":"issue_count","metricUnit":"","bestDirection":"lower"}
{"run":121,"commit":"493e3ca","metric":2,"metrics":{},"status":"discard","description":"Baseline for shell/tmux rendered-config coverage found two local-validation omissions: autoresearch.checks.sh still skips the rendered ~/.zshrc and ~/.tmux.conf targets that AGENTS.md already treats as high-impact validation surfaces.","timestamp":1776649154962,"segment":61,"confidence":null,"iterationTokens":101,"asi":{"hypothesis":"After making the remaining managed targets render-safe, the next principled validation gap is the rendered shell/tmux configs already called out in the maintainer checklist.","rollback_reason":"Baseline only; no repo changes beyond autoresearch scaffolding should be kept from this run.","next_action_hint":"Add a rendered zsh -n check for ~/.zshrc and an isolated-socket tmux source check for ~/.tmux.conf to autoresearch.checks.sh.","insight":"This is not generic coverage hunting: both targets already have canonical validation commands in AGENTS.md and ARCHITECTURE.md, so the local safety net is simply lagging the documented checklist."}}
{"run":122,"commit":"7364f3b","metric":0,"metrics":{},"status":"keep","description":"Add rendered ~/.zshrc and isolated-socket ~/.tmux.conf validation to autoresearch.checks.sh so the local safety net matches the shell/tmux checks already documented in AGENTS.md.","timestamp":1776649194300,"segment":61,"confidence":null,"iterationTokens":1531,"asi":{"hypothesis":"The shell/tmux validation checklist can be pulled into the local safety net with one render-safe zsh check and one isolated tmux source check.","insight":"This closes a real routing gap rather than expanding checks arbitrarily: the repo already treated these as high-impact surfaces, and tmux can be validated safely in-loop by using a dedicated temporary socket.","scope":"Touched only autoresearch.checks.sh.","validation":"The targeted audit cleared and the updated autoresearch checks still completed comfortably within the existing budget.","best_practice":"When a repo documents canonical validation for high-impact rendered configs, add those same checks to the lightweight local safety net using isolated tooling context where needed so user sessions are not disturbed."}}
{"type":"config","name":"Bootstrap entrypoint check audit","metricName":"issue_count","metricUnit":"","bestDirection":"lower"}
{"run":123,"commit":"7364f3b","metric":3,"metrics":{},"status":"discard","description":"Baseline for bootstrap entrypoint local coverage found three local-validation omissions: autoresearch.checks.sh still skips the documented bootstrap and hardening shell entrypoints.","timestamp":1776649301698,"segment":62,"confidence":null,"iterationTokens":99,"asi":{"hypothesis":"After aligning shell/tmux validation with the maintainer checklist, the next principled gap is that the same local safety net still omits the high-impact bootstrap entrypoints already called out in docs and skill guidance.","rollback_reason":"Baseline only; no repo changes beyond autoresearch scaffolding should be kept from this run.","next_action_hint":"Add bash -n checks for bootstrap-vps.sh, scripts/bootstrap-omarchy.sh, and scripts/server-lockdown-tailscale.sh to autoresearch.checks.sh.","insight":"This is a concrete local/CI symmetry gap: CI and the bootstrap skill already validate these entrypoints, but the lightweight local loop does not."}}
{"run":124,"commit":"c107692","metric":0,"metrics":{},"status":"keep","description":"Add local bash -n coverage for bootstrap-vps.sh, scripts/bootstrap-omarchy.sh, and scripts/server-lockdown-tailscale.sh so autoresearch.checks.sh matches the documented bootstrap-entrypoint validation guidance.","timestamp":1776649325861,"segment":62,"confidence":null,"iterationTokens":859,"asi":{"hypothesis":"The bootstrap skill's documented high-impact entrypoint checks can be pulled into the local autoresearch safety net with three straightforward bash -n lines.","insight":"This closes a clean local/CI symmetry gap: the bootstrap entrypoints were already recognized as high-impact and validated elsewhere, so adding them locally improves coverage without inventing new policy.","scope":"Touched only autoresearch.checks.sh.","validation":"The targeted audit cleared and the updated autoresearch checks still completed comfortably within the existing budget.","best_practice":"If a repo already documents and CI-validates a small set of high-impact bootstrap entrypoints, mirror those exact syntax checks in the lightweight local safety net so experiments touching bootstrap code inherit the same guardrails."}}
{"type":"config","name":"Shared helper-library check audit","metricName":"issue_count","metricUnit":"","bestDirection":"lower"}
{"run":125,"commit":"c107692","metric":3,"metrics":{},"status":"discard","description":"Baseline for shared helper-library local coverage found three local-validation omissions: autoresearch.checks.sh still skips the shared loader and helper libraries that many apply-time scripts depend on.","timestamp":1776649405319,"segment":63,"confidence":null,"iterationTokens":99,"asi":{"hypothesis":"After adding the high-impact bootstrap entrypoints locally, the next leverage point is to syntax-check the shared helper libraries directly in autoresearch.checks.sh.","rollback_reason":"Baseline only; no repo changes beyond autoresearch scaffolding should be kept from this run.","next_action_hint":"Add bash -n checks for scripts/lib/load-helpers.sh, dot_local/private_lib/chezmoi-helpers.sh, and dot_local/private_lib/chezmoi-update-helpers.sh to autoresearch.checks.sh.","insight":"This is another clean local/CI symmetry gap: the helper libraries are already validated in CI and documented as a shared contract, but the local loop still only checks selected callers."}}
{"run":126,"commit":"90df4a0","metric":0,"metrics":{},"status":"keep","description":"Add local bash -n coverage for the shared loader and helper libraries so autoresearch.checks.sh validates the helper contract directly instead of only selected caller scripts.","timestamp":1776649432639,"segment":63,"confidence":null,"iterationTokens":851,"asi":{"hypothesis":"The helper-driven script model can be guarded more directly by syntax-checking the shared libraries themselves in the local safety net.","insight":"This is high leverage for little cost: helper libraries sit under many callers, so direct local syntax checks catch source regressions earlier than relying on whichever scripts happen to be covered.","scope":"Touched only autoresearch.checks.sh.","validation":"The targeted audit cleared and the updated autoresearch checks still completed comfortably within the existing budget.","best_practice":"When many scripts share a small helper contract, syntax-check the shared helper files directly in the lightweight local safety net instead of depending only on selected caller parses."}}
{"type":"config","name":"Managed command entrypoint check audit","metricName":"issue_count","metricUnit":"","bestDirection":"lower"}
{"run":127,"commit":"90df4a0","metric":7,"metrics":{},"status":"discard","description":"Baseline for documented managed-command local coverage found seven local-validation omissions: autoresearch.checks.sh still skips the user-facing maintenance and recovery wrapper entrypoints under dot_local/bin.","timestamp":1776649515049,"segment":64,"confidence":null,"iterationTokens":100,"asi":{"hypothesis":"After covering helper libraries directly, the next concrete local/CI symmetry gap is the documented managed maintenance commands that README and tooling docs present as first-class entrypoints.","rollback_reason":"Baseline only; no repo changes beyond autoresearch scaffolding should be kept from this run.","next_action_hint":"Add bash -n checks for executable_czu, executable_czuf, executable_czl, executable_czm, executable_czb, executable_czvc, and executable_chezmoi-rerun-script to autoresearch.checks.sh.","insight":"This is user-facing rather than purely internal coverage: these wrappers are documented primary workflows, so local experiments that touch them should inherit the same syntax guardrails as CI."}}
