{"run":19,"commit":"54183cb","metric":3,"metrics":{"security_findings":0,"guidance_findings":3},"status":"discard","description":"Baseline for repo-local Claude policy discoverability found three remaining doc-routing gaps: the canonical tooling doc, AGENTS high-impact surfaces, and ARCHITECTURE routing docs still do not surface the tracked .claude/ policy file.","timestamp":1776638514537,"segment":9,"confidence":null,"iterationTokens":102,"asi":{"hypothesis":"After tightening and documenting the repo-local Claude allowlist in CLAUDE.md, the next low-hanging improvement is to surface that file in the canonical cross-tool and routing docs.","rollback_reason":"Baseline only; no repo changes beyond autoresearch instrumentation should be kept from this run.","next_action_hint":"Add a concise .claude/settings.local.json note to docs/tooling-and-skills.md and mention .claude/ in AGENTS.md plus ARCHITECTURE.md agent-config surfaces.","insight":"This is a discoverability/routing problem now, not a policy problem: the file exists and is safer, but future agents may still miss it because only the Claude-facing doc mentions it."}}
{"run":20,"commit":"7731f54","metric":0,"metrics":{"security_findings":0,"guidance_findings":0},"status":"keep","description":"Document the tracked repo-local .claude/settings.local.json policy file in the canonical tooling doc and route .claude/ through AGENTS.md plus ARCHITECTURE.md so future agents inspect it deliberately.","timestamp":1776638583116,"segment":9,"confidence":null,"iterationTokens":3876,"asi":{"hypothesis":"After tightening the repo-local Claude allowlist, the next low-risk improvement is to surface that file in the canonical cross-tool docs and routing docs so future agents do not miss it.","insight":"The remaining gap was discoverability, not policy: once .claude/settings.local.json became security-relevant tracked state, the canonical docs needed to acknowledge it wherever agent-config surfaces are enumerated.","scope":"Touched only docs/tooling-and-skills.md, AGENTS.md, and ARCHITECTURE.md.","validation":"Repo-local Claude settings JSON parse, health-check shell syntax, and targeted chezmoi dry-run for rendered agent files plus health-check all passed.","best_practice":"When a formerly obscure config file becomes part of the repo's security posture, add it to both the canonical docs and the routing docs agents use to scope inspections."}}
{"type":"config","name":"Repo-local Claude stale permission audit","metricName":"issue_count","metricUnit":"","bestDirection":"lower"}
{"run":21,"commit":"7731f54","metric":2,"metrics":{"security_findings":1,"guidance_findings":1},"status":"discard","description":"Baseline for stale repo-local Claude permissions found one concrete leftover allow rule (Bash(dscl:*)) plus the lack of a matching health-check warning.","timestamp":1776638745702,"segment":10,"confidence":null,"iterationTokens":100,"asi":{"hypothesis":"After removing wildcard WebFetch, the next evidence-backed tightening is to prune obviously unrelated command permissions from the tracked repo-local Claude allowlist.","rollback_reason":"Baseline only; no repo changes beyond autoresearch instrumentation should be kept from this run.","next_action_hint":"Remove Bash(dscl:*) from .claude/settings.local.json and add a small health-check warning so unrelated macOS account-management permissions do not silently return.","insight":"Unlike broader Bash permissions that still plausibly map to repo workflows, dscl has no footprint in repo docs or source and looks like stale permission debt."}}
{"run":22,"commit":"49345d3","metric":0,"metrics":{"security_findings":0,"guidance_findings":0},"status":"keep","description":"Remove stale Bash(dscl:*) access from the tracked repo-local Claude allowlist and add a health-check warning so unrelated macOS account-management permissions do not creep back in.","timestamp":1776638790605,"segment":10,"confidence":null,"iterationTokens":1271,"asi":{"hypothesis":"The narrowest evidence-backed permission tightening left after WebFetch cleanup is to remove Bash(dscl:*), which appears unrelated to this repo's workflows.","insight":"This change was safer than broad Bash allowlist reductions because dscl had no footprint in repo source or docs, making it a strong candidate for stale permission debt.","scope":"Touched only .claude/settings.local.json and dot_local/bin/executable_chezmoi-health-check.","validation":"Repo-local Claude settings JSON parse, health-check shell syntax, and targeted chezmoi dry-run for rendered agent files plus health-check passed.","best_practice":"When trimming tracked permission allowlists, start with entries that have no documented or implemented workflow footprint, then back the removal with a drift check."}}
{"type":"config","name":"JJ metadata prompt consistency audit","metricName":"issue_count","metricUnit":"","bestDirection":"lower"}
{"run":23,"commit":"49345d3","metric":1,"metrics":{"security_findings":0,"guidance_findings":1},"status":"discard","description":"Baseline for jj metadata prompt consistency found one remaining low-hanging gap: the Codex metadata prompt still does not front-load the skill's preferred jj status/log/diff first-pass workflow.","timestamp":1776638915236,"segment":11,"confidence":null,"iterationTokens":99,"asi":{"hypothesis":"After aligning the other skill metadata prompts, the remaining low-hanging prompt upgrade is to bring the jj metadata prompt closer to the skill's first-pass workflow.","rollback_reason":"Baseline only; no repo changes beyond autoresearch instrumentation should be kept from this run.","next_action_hint":"Update private_dot_agents/private_skills/jj/agents/openai.yaml to mention jj status/log/diff before rewrites, while keeping the prompt concise.","insight":"The jj prompt is already directionally correct, so the best improvement is small: add the first-pass inspection trio, not a longer rewrite of the whole prompt."}}
{"run":24,"commit":"e808760","metric":0,"metrics":{"security_findings":0,"guidance_findings":0},"status":"keep","description":"Strengthen the jj Codex metadata prompt so it explicitly front-loads the skill's preferred jj status / jj log / jj diff first-pass workflow.","timestamp":1776638952830,"segment":11,"confidence":null,"iterationTokens":956,"asi":{"hypothesis":"A tiny jj metadata prompt tweak that adds status/log/diff upfront will better align Codex's first move with the jj skill body.","insight":"The best jj prompt improvement was additive, not a rewrite: preserve the existing publish/recovery guidance and just add the three inspection commands agents should run before rewrites.","scope":"Touched only private_dot_agents/private_skills/jj/agents/openai.yaml.","validation":"Targeted chezmoi dry-run for the rendered jj metadata path and existing health-check/config checks passed.","best_practice":"For VCS skills, front-load the minimal inspection trio in the metadata prompt so history-changing actions start from an explicit graph/diff check."}}
{"type":"config","name":"JJ metadata recovery cue audit","metricName":"issue_count","metricUnit":"","bestDirection":"lower"}
{"run":25,"commit":"e808760","metric":1,"metrics":{"security_findings":0,"guidance_findings":1},"status":"discard","description":"Baseline for jj metadata recovery cues found one last low-hanging gap: the prompt still omits the skill's re-check / jj undo safety reminder after rewrites.","timestamp":1776639098846,"segment":12,"confidence":null,"iterationTokens":99,"asi":{"hypothesis":"After adding status/log/diff upfront, the remaining small jj prompt upgrade is to carry over the skill body's recovery/recheck cue.","rollback_reason":"Baseline only; no repo changes beyond autoresearch instrumentation should be kept from this run.","next_action_hint":"Update the jj metadata prompt with a short re-check-after-rewrites / jj undo reminder while keeping it concise.","insight":"The jj prompt can still improve without getting longer in spirit; one short safety clause should be enough."}}
{"run":26,"commit":"fb4429f","metric":0,"metrics":{"security_findings":0,"guidance_findings":0},"status":"keep","description":"Add a concise re-check / jj undo safety cue to the jj Codex metadata prompt so rewrite recovery is visible before the full skill body loads.","timestamp":1776639167106,"segment":12,"confidence":null,"iterationTokens":1064,"asi":{"hypothesis":"A final small jj metadata addition can capture the skill body's most important rewrite-safety cue without bloating the prompt.","insight":"The jj prompt now covers the two highest-leverage behaviors up front: inspect first, then re-check/recover after rewrites. That is about as much as the metadata layer should carry.","scope":"Touched only private_dot_agents/private_skills/jj/agents/openai.yaml.","validation":"Targeted chezmoi dry-run for the rendered jj metadata path and existing health-check/config checks passed.","best_practice":"For VCS prompts, pair the initial inspection commands with a one-line recovery cue so agents remember both how to start and how to back out safely."}}
{"type":"config","name":"Metadata prompt jj-status reminder audit","metricName":"issue_count","metricUnit":"","bestDirection":"lower"}
{"run":27,"commit":"fb4429f","metric":4,"metrics":{"security_findings":0,"guidance_findings":4},"status":"discard","description":"Baseline for metadata prompt consistency found four remaining gaps: the non-jj Codex skill metadata prompts still do not front-load the repo-wide jj status first-pass check from AGENTS.md.","timestamp":1776639317897,"segment":13,"confidence":null,"iterationTokens":100,"asi":{"hypothesis":"After improving content-specific prompt cues, the next cross-cutting metadata prompt win is to carry over the universal jj status check before any repo mutation.","rollback_reason":"Baseline only; no repo changes beyond autoresearch instrumentation should be kept from this run.","next_action_hint":"Add a short 'check jj status first' clause to the repo-maintainer, script-maintainer, bootstrap-operator, and version-refresh metadata prompts.","insight":"This is a pure consistency improvement: every one of these prompts already nudges read order or validation, but none currently reminds Codex to inspect tree state before editing."}}
{"run":28,"commit":"6fc4ff5","metric":0,"metrics":{"security_findings":0,"guidance_findings":0},"status":"keep","description":"Add a concise 'check jj status first' cue to the non-jj Codex metadata prompts so the repo-wide tree-state check is front-loaded across skill entry points.","timestamp":1776639379097,"segment":13,"confidence":null,"iterationTokens":1862,"asi":{"hypothesis":"A small consistency pass across the remaining Codex metadata prompts will reinforce the repo-wide jj status first-pass rule before any mutation work begins.","insight":"This was a cross-cutting prompt consistency win: once one skill carried the jj inspection trio, the rest of the mutating skill entry points benefited from at least the first tree-state reminder.","scope":"Touched only the four non-jj agents/openai.yaml metadata prompt files.","validation":"Targeted chezmoi dry-run for the rendered metadata paths and existing config/health-check checks passed.","best_practice":"When a repo has one universal preflight check, repeat it in every mutating skill entry point instead of relying on a single root doc to carry the reminder."}}
{"type":"config","name":"Metadata prompt read-first reference audit","metricName":"issue_count","metricUnit":"","bestDirection":"lower"}
{"run":29,"commit":"6fc4ff5","metric":6,"metrics":{"security_findings":0,"guidance_findings":6},"status":"discard","description":"Baseline for metadata prompt read-first alignment found six low-hanging gaps: the specialized Codex prompts still omit ARCHITECTURE and their own canonical reference docs.","timestamp":1776639644165,"segment":14,"confidence":null,"iterationTokens":100,"asi":{"hypothesis":"After front-loading jj status, the next principled metadata-prompt improvement is to also surface each skill's read-first reference docs before subsystem-specific edits.","rollback_reason":"Baseline only; no repo changes beyond autoresearch instrumentation should be kept from this run.","next_action_hint":"Add concise ARCHITECTURE plus skill-specific reference cues to the script-maintainer, bootstrap-operator, and version-refresh metadata prompts.","insight":"These prompts already carry validation and trust-gate cues, so the remaining high-value gap is what to inspect first, not more warnings about what not to do."}}
{"run":30,"commit":"e917a3c","metric":0,"metrics":{"security_findings":0,"guidance_findings":0},"status":"keep","description":"Add concise ARCHITECTURE plus skill-specific reference cues to the specialized Codex metadata prompts so Codex is nudged toward the canonical docs before subsystem-specific edits.","timestamp":1776639688717,"segment":14,"confidence":null,"iterationTokens":1889,"asi":{"hypothesis":"The next high-value metadata-prompt alignment after jj-status reminders is to front-load each specialized skill's canonical read-first docs.","insight":"These prompts were already strong on guardrails and validation; the missing piece was where to look first for subsystem-specific invariants.","scope":"Touched only the script-maintainer, bootstrap-operator, and version-refresh agents/openai.yaml metadata prompt files.","validation":"Targeted chezmoi dry-run for rendered metadata paths plus existing config/health-check checks passed.","best_practice":"Keep metadata prompts short, but always include the one or two canonical docs that encode the subsystem's invariants so agents do not skip straight to mutation."}}
{"type":"config","name":"JJ metadata publish-safety cue audit","metricName":"issue_count","metricUnit":"","bestDirection":"lower"}
{"run":31,"commit":"e917a3c","metric":1,"metrics":{"security_findings":0,"guidance_findings":1},"status":"discard","description":"Baseline for jj publish-safety cues found one remaining prompt gap: the metadata layer still omits the skill's reminder to confirm the bookmark target before publishing.","timestamp":1776639864898,"segment":15,"confidence":null,"iterationTokens":101,"asi":{"hypothesis":"After covering inspect-first and rewrite-recovery behavior, the last small jj metadata improvement is to surface the publish-target confirmation cue.","rollback_reason":"Baseline only; no repo changes beyond autoresearch instrumentation should be kept from this run.","next_action_hint":"Add a short jj bookmark list or target-confirmation clause to the jj metadata prompt without expanding it into a full push checklist.","insight":"This is a higher-value publishing cue than more generic push wording because bookmark/remote ambiguity is the specific failure mode the full skill already guards against."}}
{"run":32,"commit":"6cae4c9","metric":0,"metrics":{"security_findings":0,"guidance_findings":0},"status":"keep","description":"Add a concise jj bookmark-list confirmation cue to the jj Codex metadata prompt so publish-target checks are visible before the full skill body loads.","timestamp":1776639895367,"segment":15,"confidence":null,"iterationTokens":1208,"asi":{"hypothesis":"A final small jj metadata tweak can surface the skill body's publish-safety cue without turning the prompt into a full push checklist.","insight":"The highest-value remaining jj reminder was publish-target confirmation, not more generic push wording. Naming jj bookmark list keeps the prompt concrete and aligned with the skill body.","scope":"Touched only private_dot_agents/private_skills/jj/agents/openai.yaml.","validation":"Targeted chezmoi dry-run for rendered metadata paths plus existing config/health-check checks passed.","best_practice":"When a VCS workflow has one command that cheaply confirms the publish target, surface that exact command in the metadata prompt instead of relying on vague 'be careful when pushing' language."}}
{"type":"config","name":"Pi maintenance agent warm-path benchmark","metricName":"total_us","metricUnit":"µs","bestDirection":"lower"}
{"run":33,"commit":"6cae4c9","metric":1984793,"metrics":{"per_run_us":4961.98,"loops":400},"status":"discard","description":"Baseline for the Pi maintenance agent warm-path benchmark measured the unsupported-host/no-marker no-op path before any script restructuring.","timestamp":1776640246292,"segment":16,"confidence":null,"iterationTokens":100,"asi":{"hypothesis":"The no-op path for run_after_38 still pays avoidable setup cost because later-path functions and variables are defined before the script can exit on unsupported hosts with no opt-in marker.","rollback_reason":"Baseline only; no repo changes beyond autoresearch instrumentation should be kept from this run.","next_action_hint":"Delay later-path variables and helper functions until after the unsupported-host and no-marker gates so the common no-op path exits earlier.","insight":"A controlled temp-HOME benchmark makes this hot path measurable without touching the real machine state or depending on the current host profile."}}
{"run":34,"commit":"2395efc","metric":1363028,"metrics":{"per_run_us":3407.57,"loops":400},"status":"keep","description":"Reduce unsupported-host warm-path cost in run_after_38 by delaying later-path setup until after the early gates and avoiding needless state-file removal when the Pi agent state is already absent.","timestamp":1776640451042,"segment":16,"confidence":null,"iterationTokens":8520,"asi":{"hypothesis":"The unsupported-host/no-marker hot path can get materially cheaper if the script stops doing work that only matters for opted-in Pi-agent hosts and skips rm calls when no state file exists.","insight":"The largest win did not come from function reordering alone; it came from noticing that the unsupported-host path cleared the Pi agent state on every run even when the state file was absent, paying an unnecessary external rm cost.","scope":"Touched only .chezmoiscripts/run_after_38-setup-pi-maintenance-agent.sh.tmpl.","validation":"The rendered run_after_38 script parses, executes cleanly once in a temp HOME unsupported-host/no-marker harness, and the existing config/health-check dry-run checks still pass.","best_practice":"On always-run script paths, guard external cleanup commands behind cheap state-existence checks so no-op applies avoid spawning processes just to confirm that nothing needs deleting."}}
{"type":"config","name":"Performance summary warm-path benchmark","metricName":"total_us","metricUnit":"µs","bestDirection":"lower"}
{"run":35,"commit":"2395efc","metric":943949,"metrics":{"per_run_us":2359.87,"loops":400},"status":"discard","description":"Baseline for the non-verbose run_after_99 warm path measured the current summary script before any default-path simplification.","timestamp":1776640661044,"segment":17,"confidence":null,"iterationTokens":99,"asi":{"hypothesis":"The default VERBOSE=false path in run_after_99 still does a small amount of avoidable setup that can be moved behind an early non-verbose exit.","rollback_reason":"Baseline only; no repo changes beyond autoresearch instrumentation should be kept from this run.","next_action_hint":"Move verbose-only helper setup behind an early non-verbose exit so the common summary path stops before defining or preparing verbose-only work.","insight":"This benchmark is narrower than full apply time on purpose, but still principled: run_after_99 always runs, so shaving even modest default-path overhead there improves every warm apply."}}
{"run":36,"commit":"d97adef","metric":816723,"metrics":{"per_run_us":2041.81,"loops":400},"status":"keep","description":"Speed up the default run_after_99 warm path by exiting immediately after the non-verbose summary and moving verbose-only helper setup behind that gate.","timestamp":1776640726297,"segment":17,"confidence":null,"iterationTokens":2525,"asi":{"hypothesis":"The common VERBOSE=false path in run_after_99 can be made cheaper by returning as soon as the minimal summary is printed, instead of carrying verbose-only helper setup in the straight-line path.","insight":"Even in a small always-run script, a simple early exit for the common path can produce a real win when it avoids runtime function definitions and the rest of a large verbose-only branch.","scope":"Touched only .chezmoiscripts/run_after_99-performance-summary.sh.","validation":"bash -n passed for run_after_99, the rendered run_after_38 template still parses and executes cleanly in the temp HOME harness, and the existing config/health-check dry-run checks still pass.","best_practice":"For always-run summary scripts, structure the common non-verbose path as an early exit so optional verbose diagnostics do not stay in the hot path."}}
{"type":"config","name":"Repo-local Claude tree permission audit","metricName":"issue_count","metricUnit":"","bestDirection":"lower"}
{"run":37,"commit":"d97adef","metric":2,"metrics":{"security_findings":1,"guidance_findings":1},"status":"discard","description":"Baseline for repo-local Claude tree permission cleanup found one concrete stale allow rule plus the lack of a matching health-check warning.","timestamp":1776640905948,"segment":18,"confidence":null,"iterationTokens":100,"asi":{"hypothesis":"After removing wildcard WebFetch and Bash(dscl:*), the next evidence-backed stale permission candidate is Bash(tree:*), which lacks repo workflow evidence.","rollback_reason":"Baseline only; no repo changes beyond autoresearch instrumentation should be kept from this run.","next_action_hint":"Remove Bash(tree:*) from .claude/settings.local.json and add a small health-check warning so it does not silently return.","insight":"Unlike core repo commands such as chezmoi/jj/git, tree does not appear as a documented workflow command in the repo's docs, skills, or scripts."}}
