{"run":92,"commit":"b189264","metric":6,"metrics":{"security_findings":0,"guidance_findings":6},"status":"discard","description":"Baseline for managed helper CI syntax coverage found that the workflow still skips six documented shell entrypoints under dot_local/bin beyond the update-wrapper family.","timestamp":1776645848302,"segment":46,"confidence":null,"iterationTokens":100,"asi":{"hypothesis":"A low-risk CI pass can expand shell syntax coverage to the remaining documented managed helper commands without changing runtime behavior.","rollback_reason":"Baseline only; no repo changes beyond autoresearch instrumentation should be kept from this run.","next_action_hint":"Add bash -n lines for czb, czvc, chezmoi-health-check, chezmoi-rerun-script, chezmoi-bump, and chezmoi-check-versions to managed-npm-safety.yml after confirming they all parse cleanly.","insight":"This is broader than the earlier wrapper-only symmetry passes, but still principled because the repo currently has only one CI shell-entrypoint syntax surface and these are all documented first-class commands."}}
{"run":93,"commit":"492dff2","metric":0,"metrics":{"security_findings":0,"guidance_findings":0},"status":"keep","description":"Expand managed-npm-safety shell-entrypoint syntax checks to the remaining documented helper commands so the repo's top-level managed shell tools all get explicit CI parse coverage.","timestamp":1776645881584,"segment":46,"confidence":null,"iterationTokens":1299,"asi":{"hypothesis":"A small CI expansion can give the remaining documented dot_local/bin helper commands the same shell-parse safety net already used for the update-wrapper family.","insight":"This meaningfully reduces silent drift risk: the repo now syntax-checks not just the update wrappers but also the bump/check/audit/rerun entrypoints that users are told to rely on.","scope":"Touched only .github/workflows/managed-npm-safety.yml.","validation":"The targeted audit cleared, the newly added helper scripts all pass bash -n locally, and the existing JSON/shell/Neovim/run_after harness checks plus targeted chezmoi dry-run validation remained green.","best_practice":"If a repo has a small documented set of first-class shell entrypoints in one bin directory, syntax-check the whole documented set in CI rather than only a hand-picked subset."}}
{"type":"config","name":"Top-level bin CI syntax coverage audit","metricName":"issue_count","metricUnit":"","bestDirection":"lower"}
{"run":94,"commit":"492dff2","metric":2,"metrics":{"security_findings":0,"guidance_findings":2},"status":"discard","description":"Baseline for full top-level bin CI syntax coverage found that the workflow still skips the last two shell entrypoints in dot_local/bin: the Omarchy screenshot helper and the tmux status helper.","timestamp":1776646011858,"segment":47,"confidence":null,"iterationTokens":101,"asi":{"hypothesis":"A tiny CI extension can complete syntax coverage for the entire top-level managed bin directory without changing runtime behavior.","rollback_reason":"Baseline only; no repo changes beyond autoresearch instrumentation should be kept from this run.","next_action_hint":"Add bash -n for executable_omarchy-screenshot-active-window-clipboard and sh -n for executable_tmux-status-host to managed-npm-safety.yml.","insight":"This is broader than the documented-helper pass, but still coherent because the workflow is already the repo's only shell-entrypoint syntax surface and these are the final unmanaged omissions in dot_local/bin."}}
{"run":95,"commit":"e2a145e","metric":0,"metrics":{"security_findings":0,"guidance_findings":0},"status":"keep","description":"Complete CI syntax coverage for the remaining top-level dot_local/bin shell entrypoints by checking the Omarchy screenshot helper and the tmux status helper too.","timestamp":1776646043089,"segment":47,"confidence":null,"iterationTokens":1213,"asi":{"hypothesis":"A two-line CI extension can finish shell-parse coverage for the entire top-level managed bin directory without affecting runtime behavior.","insight":"This meaningfully closes the loop on the recent validation work: the workflow now syntax-checks every top-level shell entrypoint under dot_local/bin, not just the documented helpers.","scope":"Touched only .github/workflows/managed-npm-safety.yml.","validation":"The targeted audit cleared, the added bash -n/sh -n checks pass locally, and the existing JSON/shell/Neovim/run_after harness checks plus targeted chezmoi dry-run validation remained green.","best_practice":"If a repo already has a CI step dedicated to shell entrypoint syntax, make it cover the whole managed bin directory so stray helper scripts cannot quietly drift out of parse coverage."}}
{"type":"config","name":"Maintenance-agent sibling entrypoint syntax audit","metricName":"issue_count","metricUnit":"","bestDirection":"lower"}
{"run":96,"commit":"e2a145e","metric":1,"metrics":{"security_findings":0,"guidance_findings":1},"status":"discard","description":"Baseline for maintenance-agent sibling entrypoint syntax coverage found one remaining omission: CI parses run-maintenance.sh but still skips the adjacent git-ssh.sh helper it invokes.","timestamp":1776646216993,"segment":48,"confidence":null,"iterationTokens":101,"asi":{"hypothesis":"A one-line CI expansion can cover the remaining unvalidated maintenance-agent shell helper without changing runtime behavior.","rollback_reason":"Baseline only; no repo changes beyond autoresearch instrumentation should be kept from this run.","next_action_hint":"Add bash -n dot_local/share/pi-maintenance-agent/bin/executable_git-ssh.sh to the workflow's shell-entrypoint validation step.","insight":"This is a concrete integration gap rather than generic coverage hunting, because run-maintenance.sh explicitly points at bin/git-ssh.sh via GIT_SSH_COMMAND."}}
{"run":97,"commit":"ca3b3ac","metric":0,"metrics":{"security_findings":0,"guidance_findings":0},"status":"keep","description":"Add git-ssh.sh to the managed-npm-safety shell-entrypoint syntax checks so the Pi maintenance agent's referenced SSH helper gets the same lightweight CI parse coverage as run-maintenance.sh.","timestamp":1776646254476,"segment":48,"confidence":null,"iterationTokens":842,"asi":{"hypothesis":"A one-line CI extension can close the remaining concrete syntax-coverage gap in the Pi maintenance-agent bin directory.","insight":"This is a principled follow-through on an actual integration edge: run-maintenance.sh depends on git-ssh.sh, so validating only the former left an avoidable blind spot.","scope":"Touched only .github/workflows/managed-npm-safety.yml.","validation":"The targeted audit cleared, bash -n for executable_git-ssh.sh passed locally, and the existing JSON/shell/Neovim/run_after harness checks plus targeted chezmoi dry-run validation remained green.","best_practice":"When CI syntax-checks one entrypoint that explicitly shells out through a sibling helper script, syntax-check the helper too so parse regressions cannot hide behind the caller."}}
{"type":"config","name":"Bootstrap script CI syntax audit","metricName":"issue_count","metricUnit":"","bestDirection":"lower"}
{"run":98,"commit":"ca3b3ac","metric":3,"metrics":{"security_findings":0,"guidance_findings":3},"status":"discard","description":"Baseline for bootstrap script CI syntax coverage found that the workflow still skips the three documented high-impact bootstrap/hardening scripts even though repo docs and skills already treat them as validation targets.","timestamp":1776646390211,"segment":49,"confidence":null,"iterationTokens":99,"asi":{"hypothesis":"A small CI expansion can give the documented bootstrap/hardening scripts the same lightweight syntax safety net already applied to the managed shell entrypoints.","rollback_reason":"Baseline only; no repo changes beyond autoresearch instrumentation should be kept from this run.","next_action_hint":"Add bash -n lines for bootstrap-vps.sh, scripts/bootstrap-omarchy.sh, and scripts/server-lockdown-tailscale.sh to managed-npm-safety.yml.","insight":"This is a principled validation gap because the repo already names these scripts as high-impact surfaces and recommends bash -n on them in maintainer guidance."}}
{"run":99,"commit":"a09a433","metric":0,"metrics":{"security_findings":0,"guidance_findings":0},"status":"keep","description":"Add the documented bootstrap and hardening scripts to the workflow's shell syntax checks so the repo's high-impact setup entrypoints get the same lightweight CI parse coverage as the managed shell tools.","timestamp":1776646441089,"segment":49,"confidence":null,"iterationTokens":960,"asi":{"hypothesis":"A small CI expansion can align automated syntax coverage with the repo's own bootstrap validation guidance without changing runtime behavior.","insight":"This is a strong low-risk validation improvement because the repo already tells maintainers to run bash -n on these scripts manually; CI now helps enforce that recommendation continuously.","scope":"Touched only .github/workflows/managed-npm-safety.yml.","validation":"The targeted audit cleared, the added bootstrap scripts all pass bash -n locally, and the existing JSON/shell/Neovim/run_after harness checks plus targeted chezmoi dry-run validation remained green.","best_practice":"If maintainer guidance explicitly names a handful of scripts as high-impact validation targets, add those same parse checks to CI so the recommendation becomes routine instead of optional."}}
{"type":"config","name":"Prerequisites template check coverage audit","metricName":"issue_count","metricUnit":"","bestDirection":"lower"}
{"run":100,"commit":"a09a433","metric":1,"metrics":{"security_findings":0,"guidance_findings":1},"status":"discard","description":"Baseline for prerequisites template check coverage found one remaining local validation gap: autoresearch.checks.sh still doesn't parse the high-impact run_onchange_before_00-prerequisites.sh.tmpl template called out in maintainer validation docs.","timestamp":1776646599188,"segment":50,"confidence":null,"iterationTokens":100,"asi":{"hypothesis":"A one-line autoresearch.checks.sh expansion can align the automated local checks with the documented validation checklist for the prerequisites template.","rollback_reason":"Baseline only; no repo changes beyond autoresearch instrumentation should be kept from this run.","next_action_hint":"Add a chezmoi execute-template ... | bash -n line for run_onchange_before_00-prerequisites.sh.tmpl in autoresearch.checks.sh.","insight":"This is a worthwhile local-validation improvement because that prerequisites template is foundational and already singled out in maintainer guidance, so it should not be outside the autoresearch safety net."}}
{"run":101,"commit":"e8d534f","metric":0,"metrics":{"security_findings":0,"guidance_findings":0},"status":"keep","description":"Add the prerequisites template to autoresearch.checks.sh so the local experiment safety net parses the documented high-impact run_onchange_before_00-prerequisites.sh.tmpl script too.","timestamp":1776646642891,"segment":50,"confidence":null,"iterationTokens":1025,"asi":{"hypothesis":"A one-line check expansion can align autoresearch's local validation safety net with the maintainer checklist for the foundational prerequisites template.","insight":"This is a good balance between broader validation and loop speed: it adds a high-leverage template parse without dragging the checks back toward full apply-time validation.","scope":"Touched only autoresearch.checks.sh.","validation":"The targeted audit cleared, the prerequisites template renders and parses cleanly, and the existing JSON/shell/Neovim/run_after harness checks plus targeted chezmoi dry-run validation remained green.","best_practice":"If a maintainer checklist explicitly singles out a foundational template script for syntax validation, include it in the automated local safety net so future experiments cannot drift past that check."}}
{"type":"config","name":"Core tool-setup template check audit","metricName":"issue_count","metricUnit":"","bestDirection":"lower"}
{"run":102,"commit":"e8d534f","metric":3,"metrics":{"security_findings":0,"guidance_findings":3},"status":"discard","description":"Baseline for core tool-setup template coverage found that autoresearch.checks.sh still skips the rendered uv, node, and fzf setup templates that maintainer skills already single out in their validation examples.","timestamp":1776646758769,"segment":51,"confidence":null,"iterationTokens":101,"asi":{"hypothesis":"A small autoresearch.checks.sh expansion can align the local experiment safety net with the maintainer skills' existing validation guidance for the core tool-setup templates.","rollback_reason":"Baseline only; no repo changes beyond autoresearch instrumentation should be kept from this run.","next_action_hint":"Add chezmoi execute-template ... | bash -n lines for the uv, node, and fzf templates in autoresearch.checks.sh.","insight":"This is a good local-validation target because these are foundational tool-setup paths with existing skill-level validation guidance, not arbitrary extra parses."}}
{"run":103,"commit":"c012b7c","metric":0,"metrics":{"security_findings":0,"guidance_findings":0},"status":"keep","description":"Add the uv, node, and fzf setup templates to autoresearch.checks.sh so the local experiment safety net covers the core rendered tool-setup paths that maintainer skills already single out in validation guidance.","timestamp":1776646802073,"segment":51,"confidence":null,"iterationTokens":1274,"asi":{"hypothesis":"A few extra template-parse lines can align autoresearch's local validation net with the maintainer skills' explicit examples for core tool-setup scripts.","insight":"This keeps the local safety net focused on high-leverage setup paths rather than arbitrary breadth: these templates are already considered worth validating by the repo's own skill guidance.","scope":"Touched only autoresearch.checks.sh.","validation":"The targeted audit cleared, the added templates render and parse cleanly, and the overall check runtime stayed comfortably within the existing autoresearch budget.","best_practice":"When specialized maintainer docs consistently cite a small set of rendered templates as validation exemplars, include those same templates in the automated local check path so routine experiments inherit that coverage by default."}}
{"type":"config","name":"Externals template check audit","metricName":"issue_count","metricUnit":"","bestDirection":"lower"}
{"run":104,"commit":"c012b7c","metric":1,"metrics":{"security_findings":0,"guidance_findings":1},"status":"discard","description":"Baseline for externals template check coverage found one remaining local validation gap: autoresearch.checks.sh still doesn't render and parse .chezmoiexternal.toml.tmpl.","timestamp":1776646905064,"segment":52,"confidence":null,"iterationTokens":99,"asi":{"hypothesis":"A one-line render/parse check can align autoresearch's local safety net with the version-refresh guidance for the high-impact externals template.","rollback_reason":"Baseline only; no repo changes beyond autoresearch instrumentation should be kept from this run.","next_action_hint":"Add a chezmoi execute-template render/parse line for .chezmoiexternal.toml.tmpl to autoresearch.checks.sh.","insight":"This is a good local-validation target because externals refresh behavior is a high-impact surface and the repo already treats the template as authoritative source data."}}
{"run":105,"commit":"03ef573","metric":0,"metrics":{"security_findings":0,"guidance_findings":0},"status":"keep","description":"Add .chezmoiexternal.toml.tmpl render/parse coverage to autoresearch.checks.sh so the local experiment safety net validates the authoritative externals template too.","timestamp":1776646957147,"segment":52,"confidence":null,"iterationTokens":1030,"asi":{"hypothesis":"A one-line template render/parse check can align autoresearch's local validation net with the repo's version-refresh guidance for the high-impact externals template.","insight":"This is a good complement to the earlier script-template checks: it adds coverage for a central source-of-truth file without needing slower refresh/apply behavior in the loop.","scope":"Touched only autoresearch.checks.sh.","validation":"The targeted audit cleared, the externals template renders and parses cleanly, and the overall check runtime stayed within the existing autoresearch budget.","best_practice":"If a repo treats an externals template as an authoritative high-impact surface, include a cheap render/parse check in the automated local safety net so template drift is caught before heavier apply-time validation."}}
{"type":"config","name":"Shared helper library CI syntax audit","metricName":"issue_count","metricUnit":"","bestDirection":"lower"}
{"run":106,"commit":"03ef573","metric":3,"metrics":{"security_findings":0,"guidance_findings":3},"status":"discard","description":"Baseline for shared helper library CI syntax coverage found that the workflow still skips the three helper libraries sourced by many bootstrap, apply-time, and wrapper scripts.","timestamp":1776647093607,"segment":53,"confidence":null,"iterationTokens":100,"asi":{"hypothesis":"A small CI expansion can directly parse the shared helper libraries so syntax regressions are caught at the source instead of only indirectly through callers.","rollback_reason":"Baseline only; no repo changes beyond autoresearch instrumentation should be kept from this run.","next_action_hint":"Add bash -n lines for scripts/lib/load-helpers.sh, dot_local/private_lib/chezmoi-helpers.sh, and dot_local/private_lib/chezmoi-update-helpers.sh to managed-npm-safety.yml.","insight":"This is a high-leverage validation gap because these files are reused across many scripts, and bash -n on callers does not automatically parse sourced helper libraries."}}
{"run":107,"commit":"418316c","metric":0,"metrics":{"security_findings":0,"guidance_findings":0},"status":"keep","description":"Add the shared helper libraries to the workflow's shell syntax checks so CI parses the common sourced code directly instead of validating it only indirectly through callers.","timestamp":1776647133796,"segment":53,"confidence":null,"iterationTokens":1051,"asi":{"hypothesis":"A small CI expansion can catch syntax regressions earlier by parsing the shared helper libraries themselves.","insight":"This is high leverage for very little cost because sourced helper libraries sit under many callers, and bash -n on those callers does not automatically validate the sourced files.","scope":"Touched only .github/workflows/managed-npm-safety.yml.","validation":"The targeted audit cleared, the helper libraries all pass bash -n locally, and the existing JSON/shell/Neovim/run_after harness checks plus targeted chezmoi dry-run validation remained green.","best_practice":"When multiple shell entrypoints source a small set of shared helper libraries, syntax-check the libraries directly in CI rather than relying on caller parses that may not read sourced files."}}
{"type":"config","name":"Version-data TOML check audit","metricName":"issue_count","metricUnit":"","bestDirection":"lower"}
{"run":108,"commit":"418316c","metric":2,"metrics":{"security_findings":0,"guidance_findings":2},"status":"discard","description":"Baseline for version-data TOML check coverage found that autoresearch.checks.sh still skips the two authoritative source-of-truth TOML files: .chezmoidata.toml and .chezmoiversion.toml.","timestamp":1776647288846,"segment":54,"confidence":null,"iterationTokens":100,"asi":{"hypothesis":"A small local-check expansion can parse the repo's authoritative version-data TOML files so version-refresh style changes inherit basic syntax validation by default.","rollback_reason":"Baseline only; no repo changes beyond autoresearch instrumentation should be kept from this run.","next_action_hint":"Add tomllib parse checks for .chezmoidata.toml and .chezmoiversion.toml to autoresearch.checks.sh.","insight":"This is a principled validation gap because these files are already treated as high-impact source-of-truth surfaces in repo guidance and feed many templates/scripts."}}
{"run":109,"commit":"66c1bfb","metric":0,"metrics":{"security_findings":0,"guidance_findings":0},"status":"keep","description":"Add .chezmoidata.toml and .chezmoiversion.toml parse coverage to autoresearch.checks.sh so the local experiment safety net validates the authoritative version-data TOML files too.","timestamp":1776647333087,"segment":54,"confidence":null,"iterationTokens":1643,"asi":{"hypothesis":"A tiny tomllib parse expansion can give version-refresh style experiments basic syntax coverage for the repo's authoritative data/version files without adding heavy checks.","insight":"This complements the earlier externals-template check nicely: the local safety net now covers all three core version/external source-of-truth files instead of only the rendered externals template.","scope":"Touched only autoresearch.checks.sh.","validation":"The targeted audit cleared, both TOML files parse cleanly, and the expanded autoresearch checks still complete comfortably within the existing budget.","best_practice":"If a repo treats a small set of TOML files as authoritative version/external source data, parse all of them in the lightweight local safety net so syntax drift is caught before deeper apply-time validation."}}
{"type":"config","name":"Managed agent settings check audit","metricName":"issue_count","metricUnit":"","bestDirection":"lower"}
