{"run":55,"commit":"4febc4f","metric":4,"metrics":{"security_findings":0,"guidance_findings":4},"status":"discard","description":"Baseline for Claude allowlist policy wording found that the canonical docs still do not state the core-workflow-only / explicit-approval policy that emerged from the recent permission cleanup work.","timestamp":1776642345924,"segment":27,"confidence":null,"iterationTokens":100,"asi":{"hypothesis":"After many allowlist cleanups, the next small improvement is to document the resulting policy explicitly so future edits do not have to rediscover it from commit history.","rollback_reason":"Baseline only; no repo changes beyond autoresearch instrumentation should be kept from this run.","next_action_hint":"Add one short sentence to CLAUDE.md and docs/tooling-and-skills.md saying tracked repo-local permissions are for core workflow primitives and that one-off convenience/bootstrap commands should rely on explicit approval.","insight":"The permission surface is now cleaner than the docs imply; policy wording can catch up without reopening behavior changes."}}
{"run":56,"commit":"4eaa8dc","metric":0,"metrics":{"security_findings":0,"guidance_findings":0},"status":"keep","description":"Document in CLAUDE.md and docs/tooling-and-skills.md that tracked repo-local Claude permissions are for core workflow primitives and that one-off convenience/bootstrap commands should rely on explicit approval.","timestamp":1776642383439,"segment":27,"confidence":null,"iterationTokens":1128,"asi":{"hypothesis":"Once the tracked allowlist has been narrowed repeatedly, a short canonical policy statement can help future maintainers preserve that intent.","insight":"This was a good follow-up to the permission cleanup streak because it turns an implicit standard into an explicit one in the two docs most likely to influence future edits.","scope":"Touched only CLAUDE.md and docs/tooling-and-skills.md.","validation":"The existing JSON parse, shell syntax, run_after harness checks, and targeted chezmoi dry-run validation all remained green.","best_practice":"When repeated cleanup work reveals a stable policy, write that policy down in the canonical docs so future changes can follow the rule directly instead of inferring it from commit history."}}
{"type":"config","name":"Neovim setup semantics comment audit","metricName":"issue_count","metricUnit":"","bestDirection":"lower"}
{"run":57,"commit":"4eaa8dc","metric":2,"metrics":{"security_findings":0,"guidance_findings":2},"status":"discard","description":"Baseline for Neovim setup semantics comments found two remaining clarification gaps: the script never states that REQUIRED_NVIM_VERSION is the compatibility floor or that the pinned release is only the preferred install source.","timestamp":1776642543360,"segment":28,"confidence":null,"iterationTokens":101,"asi":{"hypothesis":"A small inline comment near the Neovim version declarations can capture the intended semantics without changing behavior.","rollback_reason":"Baseline only; no repo changes beyond autoresearch instrumentation should be kept from this run.","next_action_hint":"Add a concise two-line comment near REQUIRED_NVIM_VERSION / PINNED_NVIM_VERSION clarifying compatibility-floor vs preferred-source semantics.","insight":"This is exactly the kind of ambiguity that can lead to over-eager run_onchange state-key tightening later; documenting the contract now is cheaper than untangling a behavioral mistake later."}}
{"run":58,"commit":"b126486","metric":0,"metrics":{"security_findings":0,"guidance_findings":0},"status":"keep","description":"Clarify in the Neovim setup script that REQUIRED_NVIM_VERSION is the compatibility floor while the pinned release is only the preferred install source when package managers lag.","timestamp":1776642581715,"segment":28,"confidence":null,"iterationTokens":1022,"asi":{"hypothesis":"A tiny inline comment near the Neovim version declarations can prevent future maintainers from conflating compatibility-floor semantics with pinned-source semantics.","insight":"This was a good low-risk follow-up because it addresses a real deferred ambiguity from the backlog without changing run_onchange behavior or pinning policy.","scope":"Touched only .chezmoiscripts/run_onchange_after_24-setup-neovim.sh.tmpl.","validation":"The rendered Neovim setup script still parses, the existing JSON/shell/run_after checks still pass, and targeted chezmoi dry-run validation remains green.","best_practice":"When a setup script has both a minimum acceptable version and a preferred pinned artifact source, document the distinction inline before anyone tries to encode the wrong one into state keys or upgrade logic."}}
{"type":"config","name":"Maintenance doc czl wording audit","metricName":"issue_count","metricUnit":"","bestDirection":"lower"}
{"run":59,"commit":"b126486","metric":2,"metrics":{"security_findings":0,"guidance_findings":2},"status":"discard","description":"Baseline for maintenance-doc czl wording found one stale description path in docs/bootstrap-and-flags.md that still implies floating global npm-based Pi updates.","timestamp":1776642779059,"segment":29,"confidence":null,"iterationTokens":100,"asi":{"hypothesis":"A small docs consistency pass can align docs/bootstrap-and-flags.md with the canonical current czl wording already present in README and tooling docs.","rollback_reason":"Baseline only; no repo changes beyond autoresearch instrumentation should be kept from this run.","next_action_hint":"Replace the stale global-npm wording in docs/bootstrap-and-flags.md with the pinned-install wording already used in README and docs/tooling-and-skills.md.","insight":"This is a nice low-risk follow-up because the repo already decided the policy elsewhere; one doc simply missed the update."}}
{"run":60,"commit":"c8b1f42","metric":0,"metrics":{"security_findings":0,"guidance_findings":0},"status":"keep","description":"Align docs/bootstrap-and-flags.md with the canonical current czl wording so it no longer implies floating global npm-based Pi updates.","timestamp":1776642814321,"segment":29,"confidence":null,"iterationTokens":942,"asi":{"hypothesis":"A small documentation consistency fix can remove the last stale czl wording now that README and tooling docs already describe the pinned-install policy correctly.","insight":"This was a pure consistency cleanup: the repo had already made the policy change, but one maintenance doc still described the old npm-update behavior.","scope":"Touched only docs/bootstrap-and-flags.md.","validation":"The existing JSON parse, shell syntax, Neovim template parse, run_after harness checks, and targeted chezmoi dry-run validation all remained green.","best_practice":"When a maintenance policy changes, update every command reference doc that restates the workflow so stale operational advice does not linger in secondary docs."}}
{"type":"config","name":"Script-doc path consistency audit","metricName":"issue_count","metricUnit":"","bestDirection":"lower"}
{"run":61,"commit":"c8b1f42","metric":7,"metrics":{"security_findings":0,"guidance_findings":7},"status":"discard","description":"Baseline for script-doc path consistency found several stale references to pre-run_onchange .chezmoiscripts paths across architecture docs and shared skill references.","timestamp":1776642954458,"segment":30,"confidence":null,"iterationTokens":99,"asi":{"hypothesis":"A small docs/skill consistency pass can replace legacy run_before/run_after path references with the current run_onchange_* names and reduce agent confusion.","rollback_reason":"Baseline only; no repo changes beyond autoresearch instrumentation should be kept from this run.","next_action_hint":"Update ARCHITECTURE.md, docs/architecture-and-performance.md, script-maintainer skill docs, and version-refresh references to the current run_onchange_* paths.","insight":"This is high-leverage because these stale paths live in the docs and skill references agents use when they decide what file to inspect or validate."}}
{"run":62,"commit":"f45b095","metric":0,"metrics":{"security_findings":0,"guidance_findings":0},"status":"keep","description":"Update architecture docs and shared skill references to the current run_onchange_* .chezmoiscripts paths so agents stop chasing legacy pre-run_onchange script names.","timestamp":1776643063296,"segment":30,"confidence":null,"iterationTokens":3290,"asi":{"hypothesis":"A small doc/reference consistency pass can remove stale script-path guidance that still points at the pre-run_onchange layout.","insight":"This was higher leverage than it looked: these path names live in the docs and skill references agents consult before editing or validating scripts, so stale names can waste real troubleshooting time.","scope":"Touched only ARCHITECTURE.md, docs/architecture-and-performance.md, the script-maintainer skill/reference, and the version-refresh skill/reference.","validation":"The existing JSON parse, shell syntax, Neovim template parse, run_after harness checks, and targeted chezmoi dry-run validation all remained green.","best_practice":"Whenever script naming conventions change, update the skill/reference examples and validation snippets at the same time so agents inherit the new paths instead of cargo-culting obsolete ones."}}
{"type":"config","name":"cz helper wording consistency audit","metricName":"issue_count","metricUnit":"","bestDirection":"lower"}
{"run":63,"commit":"f45b095","metric":3,"metrics":{"security_findings":0,"guidance_findings":3},"status":"discard","description":"Baseline for cz helper wording consistency found three stale alias labels across the Claude-facing maintenance doc and the performance summary script.","timestamp":1776643267280,"segment":31,"confidence":null,"iterationTokens":99,"asi":{"hypothesis":"A tiny wording pass can align CLAUDE.md and run_after_99 with README's canonical statement that the cz* helpers are managed commands, not shell aliases.","rollback_reason":"Baseline only; no repo changes beyond autoresearch instrumentation should be kept from this run.","next_action_hint":"Replace the stale alias wording in CLAUDE.md and run_after_99 with managed-command wording.","insight":"This is low-risk but worthwhile because agents consult CLAUDE.md and the summary script in context, so inconsistent wording can still distort how they think those helpers are installed."}}
{"run":64,"commit":"1f89e06","metric":0,"metrics":{"security_findings":0,"guidance_findings":0},"status":"keep","description":"Align CLAUDE.md and the performance summary script with README's canonical wording that the cz* helpers are managed commands rather than shell aliases.","timestamp":1776643320287,"segment":31,"confidence":null,"iterationTokens":990,"asi":{"hypothesis":"A tiny wording fix can give agents one consistent mental model for the cz* helpers across the docs they actually read during maintenance work.","insight":"This was another nice consistency win: README already had the right operational model, but CLAUDE.md and run_after_99 were still teaching an older alias-oriented framing.","scope":"Touched only CLAUDE.md and .chezmoiscripts/run_after_99-performance-summary.sh.","validation":"The performance summary script still parses, the existing JSON/health-check/Neovim template checks still pass, and targeted chezmoi dry-run validation remains green.","best_practice":"When a helper graduates from an alias into a managed installed command, update every nearby doc or summary snippet that still frames it as shell sugar so operators know it works outside alias-loaded shells."}}
{"type":"config","name":"CLAUDE czb discoverability audit","metricName":"issue_count","metricUnit":"","bestDirection":"lower"}
{"run":65,"commit":"1f89e06","metric":1,"metrics":{"security_findings":0,"guidance_findings":1},"status":"discard","description":"Baseline for CLAUDE helper-command discoverability found one remaining gap: the compact managed-helper note still omits czb.","timestamp":1776643480534,"segment":32,"confidence":null,"iterationTokens":102,"asi":{"hypothesis":"A tiny CLAUDE.md update can align its managed-helper note with README and tooling docs by adding czb.","rollback_reason":"Baseline only; no repo changes beyond autoresearch instrumentation should be kept from this run.","next_action_hint":"Add czb to CLAUDE.md's managed helper command line.","insight":"This is a small consistency gap, but CLAUDE.md is one of the first maintenance docs agents read, so even a one-command omission can matter."}}
{"run":66,"commit":"7eb4a27","metric":0,"metrics":{"security_findings":0,"guidance_findings":0},"status":"keep","description":"Add czb to CLAUDE.md's managed helper command note so the compact maintenance doc matches README and tooling docs more closely.","timestamp":1776643525038,"segment":32,"confidence":null,"iterationTokens":795,"asi":{"hypothesis":"A one-command discoverability fix in CLAUDE.md will better align the short helper note with the repo's canonical command docs.","insight":"This was tiny but still worthwhile because CLAUDE.md is optimized for quick recall; if it names the managed helper family, it should include the bump helper too.","scope":"Touched only CLAUDE.md.","validation":"The existing JSON parse, shell syntax, Neovim template parse, run_after harness checks, and targeted chezmoi dry-run validation all remained green.","best_practice":"When a maintenance doc includes a compact command-family summary, keep it in sync with the canonical command list so the short form stays trustworthy."}}
{"type":"config","name":"Performance summary czm discoverability audit","metricName":"issue_count","metricUnit":"","bestDirection":"lower"}
{"run":67,"commit":"7eb4a27","metric":1,"metrics":{"security_findings":0,"guidance_findings":1},"status":"discard","description":"Baseline for performance-summary helper discoverability found one remaining gap: the shortcut list still omits the managed czm maintenance helper.","timestamp":1776643636061,"segment":33,"confidence":null,"iterationTokens":101,"asi":{"hypothesis":"A tiny summary-script update can improve helper discoverability on macOS by listing czm alongside the existing czl/czu shortcuts.","rollback_reason":"Baseline only; no repo changes beyond autoresearch instrumentation should be kept from this run.","next_action_hint":"Add czm to the helper list in run_after_99-performance-summary.sh.","insight":"This is a small UX gap, but the summary script is one of the few docs users see immediately after apply, so platform-specific helpers are worth surfacing there."}}
{"run":68,"commit":"3e6d713","metric":0,"metrics":{"security_findings":0,"guidance_findings":0},"status":"keep","description":"Add czm to the performance summary helper list so the always-run apply summary surfaces the macOS maintenance wrapper alongside the existing Arch/Linux shortcuts.","timestamp":1776643680496,"segment":33,"confidence":null,"iterationTokens":817,"asi":{"hypothesis":"A one-line summary-script addition can improve macOS helper discoverability without changing behavior or output structure materially.","insight":"This is exactly the kind of small UX paper-cut worth fixing in an always-run summary script: it already lists platform-specific maintenance helpers, so omitting the macOS one was an avoidable asymmetry.","scope":"Touched only .chezmoiscripts/run_after_99-performance-summary.sh.","validation":"The performance summary script still parses, the existing JSON/health-check/Neovim template checks still pass, and targeted chezmoi dry-run validation remains green.","best_practice":"If an always-run summary advertises platform-specific maintenance shortcuts, list all first-class platform variants so users do not infer that only one platform has a supported full-maintenance path."}}
{"type":"config","name":"CLAUDE maintenance-wrapper discoverability audit","metricName":"issue_count","metricUnit":"","bestDirection":"lower"}
{"run":69,"commit":"3e6d713","metric":2,"metrics":{"security_findings":0,"guidance_findings":2},"status":"discard","description":"Baseline for CLAUDE maintenance-wrapper discoverability found two remaining omissions: the compact helper-command note still leaves out the platform-specific czl and czm wrappers.","timestamp":1776643784342,"segment":34,"confidence":null,"iterationTokens":102,"asi":{"hypothesis":"A small CLAUDE.md wording expansion can align its helper-command note with README and tooling docs by including the platform-specific maintenance wrappers.","rollback_reason":"Baseline only; no repo changes beyond autoresearch instrumentation should be kept from this run.","next_action_hint":"Add czl and czm to the CLAUDE.md managed helper command line.","insight":"This is a discoverability tradeoff rather than a correctness bug, but CLAUDE.md has become the compact maintenance cheat sheet, so omitting two first-class wrappers is still notable."}}
{"run":70,"commit":"64a635d","metric":0,"metrics":{"security_findings":0,"guidance_findings":0},"status":"keep","description":"Add czl and czm to CLAUDE.md's managed helper command note so the compact maintenance doc includes the platform-specific full-maintenance wrappers too.","timestamp":1776643828593,"segment":34,"confidence":null,"iterationTokens":877,"asi":{"hypothesis":"A small CLAUDE.md expansion can make its compact helper-command note a more faithful shortcut map for the repo's supported maintenance wrappers.","insight":"This was still worth doing even though the helpers are documented elsewhere, because CLAUDE.md has effectively become a maintenance cheat sheet; if it names the managed helper family, it should include the platform-specific full-maintenance variants too.","scope":"Touched only CLAUDE.md.","validation":"The existing JSON parse, shell syntax, Neovim template parse, run_after harness checks, and targeted chezmoi dry-run validation all remained green.","best_practice":"If you provide a condensed command-family summary in an agent-facing doc, either keep it obviously partial or include the main platform-specific variants so the summary remains trustworthy as a cheat sheet."}}
{"type":"config","name":"Rerun-script discoverability audit","metricName":"issue_count","metricUnit":"","bestDirection":"lower"}
{"run":71,"commit":"64a635d","metric":2,"metrics":{"security_findings":0,"guidance_findings":2},"status":"discard","description":"Baseline for rerun-script discoverability found that the managed run_onchange state-reset helper is still only surfaced in README, not the maintenance docs agents read first.","timestamp":1776643932092,"segment":35,"confidence":null,"iterationTokens":101,"asi":{"hypothesis":"A small doc pass can surface chezmoi-rerun-script in CLAUDE.md and docs/tooling-and-skills.md, improving recovery-path discoverability without changing behavior.","rollback_reason":"Baseline only; no repo changes beyond autoresearch instrumentation should be kept from this run.","next_action_hint":"Add chezmoi-rerun-script to CLAUDE.md common commands and docs/tooling-and-skills.md local update commands.","insight":"This is similar in spirit to the earlier health-check discoverability fix: a low-risk recovery helper is more valuable when it is present in the maintenance docs agents already consult."}}
{"run":72,"commit":"fa615ce","metric":0,"metrics":{"security_findings":0,"guidance_findings":0},"status":"keep","description":"Surface chezmoi-rerun-script in CLAUDE.md and docs/tooling-and-skills.md so the managed run_onchange state-reset helper is discoverable from the maintenance docs agents read first.","timestamp":1776644004115,"segment":35,"confidence":null,"iterationTokens":1334,"asi":{"hypothesis":"A small docs pass can make the rerun helper easier to rediscover during setup-script recovery work without changing any behavior.","insight":"This mirrors the earlier health-check discoverability fix: recovery helpers are much more useful when they are present in the maintenance docs agents actually consult in context.","scope":"Touched only CLAUDE.md and docs/tooling-and-skills.md.","validation":"The existing JSON parse, shell syntax, Neovim template parse, run_after harness checks, and targeted chezmoi dry-run validation all remained green.","best_practice":"If a repo maintains a dedicated recovery helper for apply-time state, list it in the first-line maintenance docs instead of leaving it discoverable only in the main README table."}}
{"type":"config","name":"Performance summary rerun-helper discoverability audit","metricName":"issue_count","metricUnit":"","bestDirection":"lower"}
{"run":73,"commit":"fa615ce","metric":1,"metrics":{"security_findings":0,"guidance_findings":1},"status":"discard","description":"Baseline for performance-summary rerun-helper discoverability found one remaining gap: the always-run apply summary still omits chezmoi-rerun-script.","timestamp":1776644117703,"segment":36,"confidence":null,"iterationTokens":102,"asi":{"hypothesis":"A one-line summary-script addition can make the run_onchange state-reset helper more discoverable in the same place users already see the other maintenance helpers.","rollback_reason":"Baseline only; no repo changes beyond autoresearch instrumentation should be kept from this run.","next_action_hint":"Add chezmoi-rerun-script to the helper list in run_after_99-performance-summary.sh.","insight":"This is a small UX gap, but the summary script is intentionally a post-apply cheat sheet, so surfacing recovery helpers there is consistent with its role."}}
