{"run":38,"commit":"1cdef80","metric":0,"metrics":{"security_findings":0,"guidance_findings":0},"status":"keep","description":"Remove stale Bash(tree:*) access from the tracked repo-local Claude allowlist and add a matching health-check warning so undocumented shell-tree permissions do not silently return.","timestamp":1776640970384,"segment":18,"confidence":null,"iterationTokens":1939,"asi":{"hypothesis":"Bash(tree:*) is another low-risk evidence-backed stale permission candidate because the repo does not document tree as part of its workflows.","insight":"The strongest signal here was not raw text frequency but command-shape evidence: exact tree-command searches across docs, skills, and scripts came up empty, making this permission look like leftover convenience scope rather than an intentional repo requirement.","scope":"Touched only .claude/settings.local.json and dot_local/bin/executable_chezmoi-health-check.","validation":"Repo-local Claude settings JSON parses, health-check shell syntax passes, the existing run_after hot-path checks still pass, and targeted chezmoi dry-run validation remains green.","best_practice":"When trimming tracked shell-command allowlists, search for exact documented command usage rather than broad word matches so prose like 'skill tree' or 'tree status' does not falsely justify a stale permission."}}
{"type":"config","name":"Repo-local Claude wc permission audit","metricName":"issue_count","metricUnit":"","bestDirection":"lower"}
{"run":39,"commit":"1cdef80","metric":2,"metrics":{"security_findings":1,"guidance_findings":1},"status":"discard","description":"Baseline for repo-local Claude wc permission cleanup found one concrete stale allow rule plus the lack of a matching health-check warning.","timestamp":1776641062200,"segment":19,"confidence":null,"iterationTokens":100,"asi":{"hypothesis":"After removing tree, the next evidence-backed stale permission candidate is Bash(wc:*), which lacks agent-facing workflow evidence.","rollback_reason":"Baseline only; no repo changes beyond autoresearch instrumentation should be kept from this run.","next_action_hint":"Remove Bash(wc:*) from .claude/settings.local.json and add a small health-check warning so it does not silently return.","insight":"Unlike core repo commands, wc appears only in implementation details such as helper or health-check internals, not in the repo's documented workflows or agent guidance."}}
{"run":40,"commit":"6598655","metric":0,"metrics":{"security_findings":0,"guidance_findings":0},"status":"keep","description":"Remove stale Bash(wc:*) access from the tracked repo-local Claude allowlist and add a matching health-check warning so undocumented shell-counting permissions do not silently return.","timestamp":1776641105644,"segment":19,"confidence":null,"iterationTokens":1163,"asi":{"hypothesis":"Bash(wc:*) is another low-risk stale permission candidate because it appears only in implementation details, not agent-facing repo workflows.","insight":"After exact-command filtering, wc looked more like incidental implementation scope than an intentional repo workflow permission. The change follows the same pattern as dscl/tree: trim first, then add a drift warning.","scope":"Touched only .claude/settings.local.json and dot_local/bin/executable_chezmoi-health-check.","validation":"Repo-local Claude settings JSON parses, health-check shell syntax passes, the existing run_after hot-path checks still pass, and targeted chezmoi dry-run validation remains green.","best_practice":"When a tracked permission only supports internal implementation details rather than documented workflows, prefer removing it and letting one-off needs use explicit approval instead of baking it into the default allowlist."}}
{"type":"config","name":"Repo-local Claude cat permission audit","metricName":"issue_count","metricUnit":"","bestDirection":"lower"}
{"run":41,"commit":"6598655","metric":2,"metrics":{"security_findings":1,"guidance_findings":1},"status":"discard","description":"Baseline for repo-local Claude cat permission cleanup found one likely stale allow rule plus the lack of a matching health-check warning.","timestamp":1776641185728,"segment":20,"confidence":null,"iterationTokens":100,"asi":{"hypothesis":"After removing tree and wc, Bash(cat:*) is the next permission candidate because repo agents are expected to inspect files with dedicated read tools instead of shelling out to cat.","rollback_reason":"Baseline only; no repo changes beyond autoresearch instrumentation should be kept from this run.","next_action_hint":"Remove Bash(cat:*) from .claude/settings.local.json and add a small health-check warning so it does not silently return.","insight":"The evidence here is weaker than for tree or wc because cat is a common shell utility, but the repo's own agent workflows still point away from it by preferring direct file-reading tools."}}
{"run":42,"commit":"95907ac","metric":0,"metrics":{"security_findings":0,"guidance_findings":0},"status":"keep","description":"Remove Bash(cat:*) from the tracked repo-local Claude allowlist and add a matching health-check warning so file-reading defaults stay with dedicated tools instead of a broad shell-cat exception.","timestamp":1776641252441,"segment":20,"confidence":null,"iterationTokens":2167,"asi":{"hypothesis":"Because this repo's agents are expected to inspect files with dedicated read tools, Bash(cat:*) is another reasonable permission to trim from the default Claude allowlist.","insight":"This call was less about raw repo usage counts and more about preferred workflow: the repo's agent harnesses already provide safer direct file-reading paths, so keeping cat in the default Bash allowlist was harder to justify than leaving it available via one-off approval.","scope":"Touched only .claude/settings.local.json and dot_local/bin/executable_chezmoi-health-check.","validation":"Repo-local Claude settings JSON parses, health-check shell syntax passes, the existing run_after hot-path checks still pass, and targeted chezmoi dry-run validation remains green.","best_practice":"If an agent environment already offers a dedicated non-shell tool for a common task, keep the tracked shell allowlist narrow and rely on explicit approval for the shell fallback instead of pre-approving both paths."}}
{"type":"config","name":"Repo-local Claude alias permission audit","metricName":"issue_count","metricUnit":"","bestDirection":"lower"}
{"run":43,"commit":"95907ac","metric":2,"metrics":{"security_findings":1,"guidance_findings":1},"status":"discard","description":"Baseline for repo-local Claude alias permission cleanup found one likely stale allow rule plus the lack of a matching health-check warning.","timestamp":1776641321367,"segment":21,"confidence":null,"iterationTokens":100,"asi":{"hypothesis":"After removing cat, Bash(alias:*) is the next permission candidate because alias appears only as prose or shell-config implementation detail, not as a documented agent workflow command.","rollback_reason":"Baseline only; no repo changes beyond autoresearch instrumentation should be kept from this run.","next_action_hint":"Remove Bash(alias:*) from .claude/settings.local.json and add a small health-check warning so it does not silently return.","insight":"The evidence is similar to tree: exact-command searches find noun uses and config definitions, but no explicit workflow telling agents to run alias as part of repo maintenance."}}
{"run":44,"commit":"f8a4705","metric":0,"metrics":{"security_findings":0,"guidance_findings":0},"status":"keep","description":"Remove Bash(alias:*) from the tracked repo-local Claude allowlist and add a matching health-check warning so shell-alias convenience does not stay pre-approved without a documented workflow need.","timestamp":1776641365703,"segment":21,"confidence":null,"iterationTokens":1188,"asi":{"hypothesis":"Because the repo documents aliases as shell config and prose rather than as agent workflow commands, Bash(alias:*) can be removed from the default Claude allowlist.","insight":"Like tree, alias was easier to justify as text in the repo than as an actual workflow command. Exact-command searches found configuration and noun references, but not a maintenance flow that needed the alias builtin pre-approved.","scope":"Touched only .claude/settings.local.json and dot_local/bin/executable_chezmoi-health-check.","validation":"Repo-local Claude settings JSON parses, health-check shell syntax passes, the existing run_after hot-path checks still pass, and targeted chezmoi dry-run validation remains green.","best_practice":"Do not keep shell builtins or convenience affordances in a tracked default allowlist unless the repo actually documents a maintenance workflow that depends on them."}}
{"type":"config","name":"Repo-local Claude fetch-domain cleanup audit","metricName":"issue_count","metricUnit":"","bestDirection":"lower"}
{"run":45,"commit":"f8a4705","metric":2,"metrics":{"security_findings":1,"guidance_findings":1},"status":"discard","description":"Baseline for repo-local Claude fetch-domain cleanup found one concrete stale explicit WebFetch domain plus the lack of a matching health-check warning.","timestamp":1776641658506,"segment":22,"confidence":null,"iterationTokens":101,"asi":{"hypothesis":"After trimming stale Bash permissions, the next evidence-backed cleanup is to remove explicit WebFetch domains that have no repo workflow footprint.","rollback_reason":"Baseline only; no repo changes beyond autoresearch instrumentation should be kept from this run.","next_action_hint":"Remove WebFetch(domain:eu-central-1-1.aws.cloud2.influxdata.com) from .claude/settings.local.json and add a small health-check warning so it does not silently return.","insight":"An explicit domain can be stale even without being a wildcard; zero repo hits for the exact domain or provider name makes this a strong candidate for removal."}}
{"run":46,"commit":"bb22547","metric":0,"metrics":{"security_findings":0,"guidance_findings":0},"status":"keep","description":"Remove the stale Influx WebFetch domain from the tracked repo-local Claude allowlist and add a matching health-check warning so unused explicit fetch domains do not silently return.","timestamp":1776641698523,"segment":22,"confidence":null,"iterationTokens":1275,"asi":{"hypothesis":"Explicit WebFetch domains with no repo workflow footprint are low-risk cleanup candidates, just like stale Bash rules were.","insight":"This was the cleanest remaining fetch-domain cleanup because the domain had zero repo hits by exact name or provider family, unlike the GitHub and Tailscale domains that still map to real workflows.","scope":"Touched only .claude/settings.local.json and dot_local/bin/executable_chezmoi-health-check.","validation":"Repo-local Claude settings JSON parses, health-check shell syntax passes, the existing run_after hot-path checks still pass, and targeted chezmoi dry-run validation remains green.","best_practice":"Treat explicit network domains like shell commands: if a tracked allowlisted endpoint no longer maps to a documented or implemented workflow, remove it and add a drift warning instead of assuming explicit means necessary."}}
{"type":"config","name":"Repo-local Claude czu permission audit","metricName":"issue_count","metricUnit":"","bestDirection":"lower"}
{"run":47,"commit":"bb22547","metric":2,"metrics":{"security_findings":1,"guidance_findings":1},"status":"discard","description":"Baseline for repo-local Claude czu permission cleanup found one likely stale convenience-command allow rule plus the lack of a matching health-check warning.","timestamp":1776641789846,"segment":23,"confidence":null,"iterationTokens":101,"asi":{"hypothesis":"After trimming stale Bash rules and an unused fetch domain, Bash(czu:*) is the next candidate because czu is a user-facing wrapper rather than a core agent workflow primitive.","rollback_reason":"Baseline only; no repo changes beyond autoresearch instrumentation should be kept from this run.","next_action_hint":"Remove Bash(czu:*) from .claude/settings.local.json and add a small health-check warning so convenience wrappers do not silently stay pre-approved.","insight":"This is a workflow-shape judgment more than a pure grep result: czu is well documented for humans, but the repo's agent guidance already teaches the lower-level jj/chezmoi commands directly."}}
{"run":48,"commit":"6547df5","metric":0,"metrics":{"security_findings":0,"guidance_findings":0},"status":"keep","description":"Remove Bash(czu:*) from the tracked repo-local Claude allowlist and add a matching health-check warning so the user-facing update wrapper does not stay pre-approved without an explicit agent-workflow need.","timestamp":1776641841173,"segment":23,"confidence":null,"iterationTokens":1196,"asi":{"hypothesis":"Because czu is a convenience wrapper around underlying jj/chezmoi operations, it can be removed from the default Claude allowlist without weakening core repo workflows.","insight":"This was less about raw command absence and more about layering: the repo explicitly teaches agents the lower-level jj/chezmoi workflow, so pre-approving a higher-level human convenience wrapper added scope without adding much unique capability.","scope":"Touched only .claude/settings.local.json and dot_local/bin/executable_chezmoi-health-check.","validation":"Repo-local Claude settings JSON parses, health-check shell syntax passes, the existing run_after hot-path checks still pass, and targeted chezmoi dry-run validation remains green.","best_practice":"Keep tracked agent allowlists focused on core workflow primitives; user-facing convenience wrappers can rely on explicit approval when needed."}}
{"type":"config","name":"Repo-local Claude chmod permission audit","metricName":"issue_count","metricUnit":"","bestDirection":"lower"}
{"run":49,"commit":"6547df5","metric":2,"metrics":{"security_findings":1,"guidance_findings":1},"status":"discard","description":"Baseline for repo-local Claude chmod permission cleanup found one likely non-core allow rule plus the lack of a matching health-check warning.","timestamp":1776641943432,"segment":24,"confidence":null,"iterationTokens":100,"asi":{"hypothesis":"After removing convenience commands and stale helpers, Bash(chmod:*) is the next candidate because chmod shows up in bootstrap snippets and implementation details rather than agent-facing workflows.","rollback_reason":"Baseline only; no repo changes beyond autoresearch instrumentation should be kept from this run.","next_action_hint":"Remove Bash(chmod:*) from .claude/settings.local.json and add a small health-check warning so bootstrap-style permission tweaks are not silently pre-approved.","insight":"This is another workflow-scope judgment: the command exists in the repo, but mostly as human bootstrap/setup detail rather than an instruction agents are expected to follow routinely."}}
{"run":50,"commit":"305ba3d","metric":0,"metrics":{"security_findings":0,"guidance_findings":0},"status":"keep","description":"Remove Bash(chmod:*) from the tracked repo-local Claude allowlist and add a matching health-check warning so bootstrap-style permission tweaks are not silently pre-approved as default agent workflow.","timestamp":1776641987343,"segment":24,"confidence":null,"iterationTokens":1189,"asi":{"hypothesis":"Because chmod appears in bootstrap snippets and implementation details rather than agent-facing maintenance workflows, it can be removed from the default Claude allowlist.","insight":"This continues the same narrowing principle as czu: commands that exist in the repo but are not part of the repo's normal agent workflow should rely on explicit approval rather than tracked pre-approval.","scope":"Touched only .claude/settings.local.json and dot_local/bin/executable_chezmoi-health-check.","validation":"Repo-local Claude settings JSON parses, health-check shell syntax passes, the existing run_after hot-path checks still pass, and targeted chezmoi dry-run validation remains green.","best_practice":"Keep tracked agent allowlists centered on routine workflow primitives, not on one-off bootstrap or setup commands that can safely prompt when needed."}}
{"type":"config","name":"Repo-local Claude mkdir permission audit","metricName":"issue_count","metricUnit":"","bestDirection":"lower"}
{"run":51,"commit":"305ba3d","metric":2,"metrics":{"security_findings":1,"guidance_findings":1},"status":"discard","description":"Baseline for repo-local Claude mkdir permission cleanup found one likely non-core allow rule plus the lack of a matching health-check warning.","timestamp":1776642057425,"segment":25,"confidence":null,"iterationTokens":100,"asi":{"hypothesis":"After removing chmod, Bash(mkdir:*) is the next candidate because mkdir shows up in bootstrap snippets and implementation details rather than agent-facing workflows.","rollback_reason":"Baseline only; no repo changes beyond autoresearch instrumentation should be kept from this run.","next_action_hint":"Remove Bash(mkdir:*) from .claude/settings.local.json and add a small health-check warning so bootstrap-style directory creation is not silently pre-approved.","insight":"This follows the same workflow-scope principle as chmod: commands can exist in repo docs and scripts without belonging in the tracked default agent allowlist."}}
{"run":52,"commit":"f4371ad","metric":0,"metrics":{"security_findings":0,"guidance_findings":0},"status":"keep","description":"Remove Bash(mkdir:*) from the tracked repo-local Claude allowlist and add a matching health-check warning so bootstrap-style directory creation is not silently pre-approved as default agent workflow.","timestamp":1776642098761,"segment":25,"confidence":null,"iterationTokens":1152,"asi":{"hypothesis":"Because mkdir appears in bootstrap snippets and implementation details rather than agent-facing maintenance workflows, it can be removed from the default Claude allowlist.","insight":"This confirms the workflow-scope pattern still applies after the obvious stale commands were gone: some remaining permissions were only justified by human bootstrap context, not by the repo's normal agent operating path.","scope":"Touched only .claude/settings.local.json and dot_local/bin/executable_chezmoi-health-check.","validation":"Repo-local Claude settings JSON parses, health-check shell syntax passes, the existing run_after hot-path checks still pass, and targeted chezmoi dry-run validation remains green.","best_practice":"Use tracked project-local allowlists for routine agent workflows, not for bootstrap/setup commands that can safely prompt for approval when they arise."}}
{"type":"config","name":"Repo-local Claude source permission audit","metricName":"issue_count","metricUnit":"","bestDirection":"lower"}
{"run":53,"commit":"f4371ad","metric":2,"metrics":{"security_findings":1,"guidance_findings":1},"status":"discard","description":"Baseline for repo-local Claude source permission cleanup found one likely non-core allow rule plus the lack of a matching health-check warning.","timestamp":1776642166877,"segment":26,"confidence":null,"iterationTokens":100,"asi":{"hypothesis":"After trimming bootstrap-style commands, Bash(source:*) is the next candidate because source appears in script-contract and implementation details rather than agent-facing workflows.","rollback_reason":"Baseline only; no repo changes beyond autoresearch instrumentation should be kept from this run.","next_action_hint":"Remove Bash(source:*) from .claude/settings.local.json and add a small health-check warning so shell sourcing is not silently pre-approved.","insight":"This is the most judgment-heavy remaining Bash rule so far: the command is common in implementation guidance, but the repo's agent-facing operating path still does not rely on it as a default workflow primitive."}}
{"run":54,"commit":"4febc4f","metric":0,"metrics":{"security_findings":0,"guidance_findings":0},"status":"keep","description":"Remove Bash(source:*) from the tracked repo-local Claude allowlist and add a matching health-check warning so script-implementation sourcing is not silently pre-approved as default agent workflow.","timestamp":1776642219039,"segment":26,"confidence":null,"iterationTokens":1508,"asi":{"hypothesis":"Because source appears in script-contract and implementation details rather than the repo's default agent workflow, it can be removed from the tracked Claude allowlist.","insight":"This was the last judgment-heavy non-core Bash rule: once bootstrap/setup conveniences were removed, source still looked more like implementation scaffolding than a routine agent operation. Prompt-on-demand is an acceptable fallback for the rare cases that truly need it.","scope":"Touched only .claude/settings.local.json and dot_local/bin/executable_chezmoi-health-check.","validation":"Repo-local Claude settings JSON parses, health-check shell syntax passes, the existing run_after hot-path checks still pass, and targeted chezmoi dry-run validation remains green.","best_practice":"When a command is mostly mentioned as implementation scaffolding rather than as a normal operator workflow, prefer explicit approval over tracked pre-approval in a repo-local allowlist."}}
{"type":"config","name":"Claude allowlist policy wording audit","metricName":"issue_count","metricUnit":"","bestDirection":"lower"}
