{"type":"config","name":"Agent safety low-hanging improvements audit","metricName":"issue_count","metricUnit":"","bestDirection":"lower"}
{"run":1,"commit":"0ec273e","metric":1,"metrics":{"security_findings":1,"guidance_findings":0},"status":"checks_failed","description":"Baseline audit found one concrete security issue (Claude dangerous-mode prompt bypass), but full chezmoi apply validation timed out and needs a faster check path.","timestamp":1776636261469,"segment":0,"confidence":null,"iterationTokens":141,"asi":{"hypothesis":"Baseline the current agent-safety audit before changing repo docs or client settings.","rollback_reason":"Validation strategy was too heavy for an autoresearch loop because chezmoi apply exceeded the checks timeout.","next_action_hint":"Replace the slow validation step with a lighter but still principled check (JSON parse plus targeted chezmoi render/status verification) before trying repo changes.","insight":"The initial audit already exposed a real low-hanging security improvement; the bottleneck is validation, not idea generation."}}
{"run":2,"commit":"ae9bd64","metric":0,"metrics":{"security_findings":0,"guidance_findings":0},"status":"keep","description":"Disable Claude's tracked dangerous-mode prompt bypass and add concise guardrails in CLAUDE.md plus the repo-maintainer skill so safety-bypass settings stay opt-in and local-only.","timestamp":1776636447587,"segment":0,"confidence":null,"iterationTokens":10015,"asi":{"hypothesis":"Removing the committed Claude permission-bypass plus adding small guidance guardrails will eliminate the low-hanging safety finding without widening scope.","insight":"A single client-config default (`skipDangerousModePermissionPrompt`) was the clearest low-risk security win. Minimal docs/skill reinforcement helps prevent regressions even though the main metric was driven by the config fix.","guardrail":"Keep approval/prompt bypasses out of tracked client configs; if needed, use machine-local untracked overrides instead.","scope":"Touched only Claude client config, Claude-facing repo guidance, and the cross-cutting repo-maintainer skill.","validation":"JSON parse + targeted chezmoi dry-run for rendered Claude settings and shared skill path passed."}}
{"type":"config","name":"Agent prompt and skill guidance low-hanging improvements audit","metricName":"issue_count","metricUnit":"","bestDirection":"lower"}
{"run":3,"commit":"ae9bd64","metric":2,"metrics":{"security_findings":0,"guidance_findings":2},"status":"discard","description":"Baseline for the broadened prompt/skill audit found two remaining low-hanging guidance issues: missing Claude first-pass workflow cues and a weak repo-maintainer Codex metadata prompt.","timestamp":1776636597780,"segment":1,"confidence":null,"iterationTokens":120,"asi":{"hypothesis":"Re-baseline after broadening the audit from client-config safety into prompt/skill guidance quality.","rollback_reason":"Baseline only; no repo changes beyond autoresearch scaffolding should be kept from this run.","next_action_hint":"Add a concise First Pass section to CLAUDE.md and strengthen the repo-maintainer openai metadata prompt with planning and validation reminders.","insight":"The next improvements are lightweight documentation/prompt nudges rather than behavior changes, so targeted edits should be sufficient."}}
{"run":4,"commit":"3551687","metric":0,"metrics":{"security_findings":0,"guidance_findings":0},"status":"keep","description":"Add a concise First Pass checklist to CLAUDE.md and strengthen the repo-maintainer Codex metadata prompt with read-order, planning, and chezmoi validation reminders.","timestamp":1776636637655,"segment":1,"confidence":null,"iterationTokens":3046,"asi":{"hypothesis":"A small Claude-first-pass section plus stronger repo-maintainer metadata prompting will remove the remaining guidance findings with minimal doc churn.","insight":"The most effective low-hanging prompt improvements were not longer docs, but short high-leverage reminders placed directly in the tool-specific surfaces agents actually load early.","scope":"Touched only CLAUDE.md and private_dot_agents/private_skills/chezmoi-repo-maintainer/agents/openai.yaml.","validation":"Targeted chezmoi dry-run for the rendered skill metadata path and Claude settings path passed; no behavior or bootstrap scripts changed.","best_practice":"Mirror the AGENTS first-pass workflow in tool-specific prompts so individual clients don't rely on implicit inheritance from repo-root docs alone."}}
{"type":"config","name":"Agent config health-check low-hanging improvements audit","metricName":"issue_count","metricUnit":"","bestDirection":"lower"}
{"run":5,"commit":"3551687","metric":2,"metrics":{"security_findings":1,"guidance_findings":1},"status":"discard","description":"Baseline for agent-config health-check coverage found two low-hanging gaps: no check for Claude's dangerous-mode prompt setting and no shared-skill-routing verification for Codex/Claude.","timestamp":1776636783966,"segment":2,"confidence":null,"iterationTokens":103,"asi":{"hypothesis":"Broaden the audit from docs/prompt guidance into durable operational checks inside chezmoi-health-check.","rollback_reason":"Baseline only; no repo changes beyond autoresearch instrumentation should be kept from this run.","next_action_hint":"Add a small Agent Configuration section to chezmoi-health-check that validates shared skill-tree routing and warns if Claude bypasses dangerous-mode confirmation.","insight":"The next best improvement is to turn the earlier documentation/security work into runtime checks so local drift and regressions become visible."}}
{"run":6,"commit":"42e7c52","metric":0,"metrics":{"security_findings":0,"guidance_findings":0},"status":"keep","description":"Add an Agent Configuration section to chezmoi-health-check so it verifies shared skill routing for Codex/Claude and warns if Claude enables the dangerous-mode permission bypass.","timestamp":1776636838853,"segment":2,"confidence":null,"iterationTokens":3649,"asi":{"hypothesis":"A small operational health-check addition can turn the earlier prompt/security fixes into durable runtime validation with minimal script churn.","insight":"For this repo, the best low-hanging follow-up after docs/prompt fixes was a lightweight operational check: it catches local drift and makes regressions visible without touching bootstrap behavior.","scope":"Touched only dot_local/bin/executable_chezmoi-health-check.","validation":"bash -n passed and chezmoi dry-run for ~/.local/bin/chezmoi-health-check plus rendered agent paths passed.","best_practice":"When a client-config safety default matters, back it with a cheap health-check instead of relying on docs alone."}}
{"type":"config","name":"Agent safety docs discoverability low-hanging improvements audit","metricName":"issue_count","metricUnit":"","bestDirection":"lower"}
{"run":7,"commit":"42e7c52","metric":2,"metrics":{"security_findings":0,"guidance_findings":2},"status":"discard","description":"Baseline for agent-safety docs discoverability found two small gaps: README does not mention chezmoi-health-check, and docs/tooling-and-skills lacks a canonical cross-tool note about local-only client-config safety bypasses.","timestamp":1776636918218,"segment":3,"confidence":null,"iterationTokens":104,"asi":{"hypothesis":"After improving runtime checks, the next low-hanging win is making those safeguards discoverable in user-facing and canonical docs.","rollback_reason":"Baseline only; no repo changes beyond autoresearch instrumentation should be kept from this run.","next_action_hint":"Add chezmoi-health-check to the README command table and add a short cross-tool client-config safety/defaults note to docs/tooling-and-skills.md.","insight":"The remaining improvements are documentation discoverability gaps, not code behavior changes."}}
{"run":8,"commit":"6f63180","metric":0,"metrics":{"security_findings":0,"guidance_findings":0},"status":"keep","description":"Document chezmoi-health-check in README and add a canonical cross-tool note that tracked client-config safety bypasses belong in local untracked overrides.","timestamp":1776636957044,"segment":3,"confidence":null,"iterationTokens":5594,"asi":{"hypothesis":"Small discoverability docs changes will make the new agent safety checks easier to find and will establish one canonical cross-tool default for client-config safety relaxations.","insight":"Once the guardrails existed in config, prompts, and health checks, the next best low-hanging improvement was discoverability: put the command in README and the policy in the canonical tooling doc.","scope":"Touched only README.md and docs/tooling-and-skills.md.","validation":"Targeted health-check syntax/render validation still passed; no script behavior changed in this run.","best_practice":"After adding a low-risk safety mechanism, document both how to run it and the policy it enforces so future edits have a stable reference."}}
{"type":"config","name":"Agent health-check visibility in maintenance docs audit","metricName":"issue_count","metricUnit":"","bestDirection":"lower"}
{"run":9,"commit":"6f63180","metric":2,"metrics":{"security_findings":0,"guidance_findings":2},"status":"discard","description":"Baseline for agent health-check visibility found two final discoverability gaps: CLAUDE.md and docs/tooling-and-skills still do not surface chezmoi-health-check.","timestamp":1776637016085,"segment":4,"confidence":null,"iterationTokens":102,"asi":{"hypothesis":"The remaining low-hanging improvement is to surface chezmoi-health-check in the maintenance docs agents actually read, not just in README.","rollback_reason":"Baseline only; no repo changes beyond autoresearch instrumentation should be kept from this run.","next_action_hint":"Add chezmoi-health-check to CLAUDE.md common commands and to docs/tooling-and-skills Local Update Commands.","insight":"After fixing config, prompt, skill, health-check, and README gaps, discoverability in agent-facing maintenance docs is the last obvious small follow-up."}}
{"run":10,"commit":"c35a9fb","metric":0,"metrics":{"security_findings":0,"guidance_findings":0},"status":"keep","description":"Surface chezmoi-health-check in CLAUDE.md and docs/tooling-and-skills so agents can find the managed sanity-check command from their maintenance docs.","timestamp":1776637045294,"segment":4,"confidence":null,"iterationTokens":1239,"asi":{"hypothesis":"Adding the health-check command to agent-facing maintenance docs will close the final low-hanging discoverability gap without changing behavior.","insight":"Once safety checks exist, the next leverage point is the docs agents actually read first; surfacing the command there is higher value than adding more prose elsewhere.","scope":"Touched only CLAUDE.md and docs/tooling-and-skills.md.","validation":"Targeted health-check syntax/render validation continued to pass.","best_practice":"Put operational sanity-check commands in the first-line maintenance docs, not only in README, so agents and humans can discover them in context."}}
{"type":"config","name":"Codex trust config low-hanging improvements audit","metricName":"issue_count","metricUnit":"","bestDirection":"lower"}
{"run":11,"commit":"c35a9fb","metric":3,"metrics":{"security_findings":1,"guidance_findings":2},"status":"discard","description":"Baseline for the Codex-focused follow-up found three low-hanging issues: trusted workspace config lacks rationale/override guidance, health-check omits Codex AGENTS/config validation, and tooling docs don't mention the routed ~/.codex/AGENTS.md entry point.","timestamp":1776637368849,"segment":5,"confidence":null,"iterationTokens":103,"asi":{"hypothesis":"Broaden the low-hanging safety audit from Claude/docs work into the remaining Codex-specific trust and discoverability surfaces.","rollback_reason":"Baseline only; no repo changes beyond autoresearch instrumentation should be kept from this run.","next_action_hint":"Add explanatory comments to private_dot_codex/private_config.toml.tmpl, extend chezmoi-health-check with Codex AGENTS/config checks, and document ~/.codex/AGENTS.md in docs/tooling-and-skills.md.","insight":"The next promising improvements are still minimal and low-risk: clarify an intentional trusted default instead of changing it blindly, then add cheap operational visibility around the rendered Codex files."}}
{"run":12,"commit":"4506f6d","metric":0,"metrics":{"security_findings":0,"guidance_findings":0},"status":"keep","description":"Document the rationale and local-override path for Codex's trusted workspace config, add Codex AGENTS/config checks to chezmoi-health-check, and document the routed ~/.codex/AGENTS.md entry point.","timestamp":1776637447149,"segment":5,"confidence":null,"iterationTokens":4751,"asi":{"hypothesis":"Keep the existing Codex trusted-workspace default but make it intentional and observable via inline rationale, docs, and a cheap health check instead of changing the default blindly.","insight":"The lowest-risk Codex improvement was clarification plus runtime visibility: comments explain why the repo is trusted, docs expose the routed AGENTS entry point, and health-check catches missing Codex files without forcing a trust-level policy change.","scope":"Touched private_dot_codex/private_config.toml.tmpl, dot_local/bin/executable_chezmoi-health-check, docs/tooling-and-skills.md, and pruned the resolved Codex trust idea from autoresearch.ideas.md.","validation":"Rendered Codex TOML parses, health-check shell syntax passed, and chezmoi dry-run for ~/.codex/config.toml, ~/.codex/AGENTS.md, and ~/.local/bin/chezmoi-health-check passed.","best_practice":"For client-config defaults that may look security-sensitive but are operationally intentional, document the rationale and local override path before changing behavior."}}
{"type":"config","name":"Agent override guidance clarity audit","metricName":"issue_count","metricUnit":"","bestDirection":"lower"}
{"run":13,"commit":"4506f6d","metric":3,"metrics":{"security_findings":1,"guidance_findings":2},"status":"discard","description":"Baseline for override-guidance clarity found three remaining issues: Codex comments suggest editing a managed file for overrides, and CLAUDE/tooling docs still use vague local-override wording without concrete client-supported mechanisms.","timestamp":1776637687180,"segment":6,"confidence":null,"iterationTokens":99,"asi":{"hypothesis":"After documenting Codex trust rationale, the next low-hanging improvement is to make override guidance precise so users aren't pointed at managed files or vague local-override advice.","rollback_reason":"Baseline only; no repo changes beyond autoresearch instrumentation should be kept from this run.","next_action_hint":"Update the Codex config comment to show a `codex -c ...` override example, and revise CLAUDE.md plus docs/tooling-and-skills.md to mention Claude's `--settings` / `--setting-sources` mechanisms.","insight":"The repo now has the right safety posture, but the wording around how to deviate from defaults is still too hand-wavy and partly misleading."}}
{"run":14,"commit":"c39b497","metric":0,"metrics":{"security_findings":0,"guidance_findings":0},"status":"keep","description":"Replace vague local-override wording with concrete client-supported mechanisms: use `codex -c ...` for Codex trust overrides and `claude --settings` / `--setting-sources` for Claude deviations.","timestamp":1776637769105,"segment":6,"confidence":null,"iterationTokens":13292,"asi":{"hypothesis":"After clarifying why the repo trusts Codex by default, the next low-risk improvement is to point users at real override mechanisms instead of vague or misleading local-file advice.","insight":"The earlier safety docs were directionally correct but too vague. Naming concrete override mechanisms reduced ambiguity without changing any runtime defaults.","scope":"Touched only private_dot_codex/private_config.toml.tmpl, CLAUDE.md, and docs/tooling-and-skills.md.","validation":"Rendered Codex TOML parses, health-check shell syntax passed, and chezmoi dry-run for ~/.codex/config.toml, ~/.codex/AGENTS.md, and ~/.local/bin/chezmoi-health-check passed.","best_practice":"When repo-managed config recommends deviating from defaults, document the tool's actual override interface instead of implying that editing managed files is the right path."}}
{"type":"config","name":"Repo-local Claude permissions tightening audit","metricName":"issue_count","metricUnit":"","bestDirection":"lower"}
{"run":15,"commit":"c39b497","metric":3,"metrics":{"security_findings":1,"guidance_findings":2},"status":"discard","description":"Baseline for repo-local Claude permission tightening found three issues: the tracked project settings still allow WebFetch(domain:*), CLAUDE.md doesn't explain the file's role, and health-check lacks a wildcard-permission warning.","timestamp":1776637906957,"segment":7,"confidence":null,"iterationTokens":100,"asi":{"hypothesis":"The next low-hanging security win is to tighten the tracked repo-local Claude permission allowlist and document what that file is for.","rollback_reason":"Baseline only; no repo changes beyond autoresearch instrumentation should be kept from this run.","next_action_hint":"Remove WebFetch(domain:*) from .claude/settings.local.json, add a concise note in CLAUDE.md about the file's tracked repo-local role, and extend chezmoi-health-check to warn on wildcard WebFetch permissions.","insight":"This is stronger than a docs-only improvement: the wildcard fetch permission is a concrete broad allowance that can be narrowed with little workflow risk because explicit domains already exist."}}
{"run":16,"commit":"195fe41","metric":0,"metrics":{"security_findings":0,"guidance_findings":0},"status":"keep","description":"Tighten the tracked repo-local Claude allowlist by removing wildcard WebFetch access, document .claude/settings.local.json as a tracked project-local file, and add a health-check warning for wildcard fetch permissions.","timestamp":1776638014209,"segment":7,"confidence":null,"iterationTokens":4776,"asi":{"hypothesis":"The next low-risk security win is to remove overly broad wildcard WebFetch permissions from the tracked repo-local Claude settings while documenting the file's role.","insight":"This was a concrete security tightening, not just a doc cleanup: the wildcard domain permission made explicit domain entries redundant, so removing it preserves needed domains while shrinking the default permission surface.","scope":"Touched .claude/settings.local.json, CLAUDE.md, and dot_local/bin/executable_chezmoi-health-check.","validation":"Repo-local Claude settings JSON parses, health-check shell syntax passed, and targeted chezmoi dry-run for rendered agent files plus health-check passed.","best_practice":"Tracked project-local permission files should stay narrowly scoped and explicitly documented so agents do not normalize broad wildcards."}}
{"type":"config","name":"Specialized skill metadata prompt audit","metricName":"issue_count","metricUnit":"","bestDirection":"lower"}
{"run":17,"commit":"195fe41","metric":3,"metrics":{"security_findings":0,"guidance_findings":3},"status":"discard","description":"Baseline for specialized skill metadata prompts found three remaining low-hanging guidance gaps across the script-maintainer, bootstrap-operator, and version-refresh Codex prompts.","timestamp":1776638158247,"segment":8,"confidence":null,"iterationTokens":100,"asi":{"hypothesis":"After strengthening the repo-maintainer Codex prompt, the next low-hanging improvement is to bring the other specialized skill metadata prompts up to the same standard.","rollback_reason":"Baseline only; no repo changes beyond autoresearch instrumentation should be kept from this run.","next_action_hint":"Add concise trust-gate and validation reminders to the script-maintainer prompt, security/validation reminders to the bootstrap prompt, and refresh-externals plus validation reminders to the version-refresh prompt.","insight":"These metadata prompts are a high-leverage place to encode best practices because Codex sees them before loading the full skill body."}}
{"run":18,"commit":"54183cb","metric":0,"metrics":{"security_findings":0,"guidance_findings":0},"status":"keep","description":"Strengthen the specialized Codex skill metadata prompts so script-maintainer, bootstrap-operator, and version-refresh all remind Codex about trust gates and subsystem-specific validation.","timestamp":1776638222724,"segment":8,"confidence":null,"iterationTokens":1935,"asi":{"hypothesis":"Bringing the remaining specialized `agents/openai.yaml` prompts up to the repo-maintainer standard will close another set of low-hanging prompt-quality gaps.","insight":"Small metadata prompt upgrades are high leverage because Codex sees them before loading the full skill body; they improve early behavior without adding much maintenance burden.","scope":"Touched only the three specialized skill metadata files under private_dot_agents/private_skills/*/agents/openai.yaml.","validation":"Targeted chezmoi dry-run for the rendered skill metadata paths and existing config/health-check checks passed.","best_practice":"Use short metadata prompts to front-load non-negotiable trust-gate and validation cues, then let the full skill body provide depth."}}
{"type":"config","name":"Repo-local Claude policy file discoverability audit","metricName":"issue_count","metricUnit":"","bestDirection":"lower"}
