{"run":74,"commit":"f894e80","metric":0,"metrics":{"security_findings":0,"guidance_findings":0},"status":"keep","description":"Add chezmoi-rerun-script to the performance summary helper list so the always-run apply summary surfaces the run_onchange recovery helper alongside the other managed maintenance commands.","timestamp":1776644163751,"segment":36,"confidence":null,"iterationTokens":887,"asi":{"hypothesis":"A one-line summary-script addition can improve recovery-helper discoverability without changing behavior or cluttering the summary much.","insight":"This complements the earlier doc fix nicely: once the helper was surfaced in CLAUDE/tooling docs, the always-run summary became the last high-visibility place that still omitted it.","scope":"Touched only .chezmoiscripts/run_after_99-performance-summary.sh.","validation":"The performance summary script still parses, the existing JSON/health-check/Neovim template checks still pass, and targeted chezmoi dry-run validation remains green.","best_practice":"If an apply summary doubles as a maintenance cheat sheet, include the main recovery helper there too—not just the steady-state commands—so users can recover from run_onchange drift without hunting through deeper docs."}}
{"type":"config","name":"Combined always-run warm-path benchmark","metricName":"total_us","metricUnit":"µs","bestDirection":"lower"}
{"run":75,"commit":"f894e80","metric":2223511,"metrics":{"per_pair_us":5558.78,"loops":400},"status":"discard","description":"Baseline for the combined always-run warm path measured the residual cost of the unsupported-host run_after_38 no-op plus the non-verbose run_after_99 summary after the recent low-hanging cleanups.","timestamp":1776644318501,"segment":37,"confidence":null,"iterationTokens":100,"asi":{"hypothesis":"After the individual warm-path cleanups, the next performance step should start from a combined benchmark of the only two always-run scripts before considering any larger plan-first work.","rollback_reason":"Baseline only; no repo changes beyond autoresearch instrumentation should be kept from this run.","next_action_hint":"Inspect the combined benchmark and only pursue further performance work if a behavior-preserving optimization path is clearer than the current deeper-plan backlog.","insight":"The residual combined warm-path cost is now on the order of ~5.6 ms per apply in this harness, which is much smaller than before and supports the idea that further wins are likely to require larger, more deliberate changes."}}
{"type":"config","name":"Maintainer rerun-helper discoverability audit","metricName":"issue_count","metricUnit":"","bestDirection":"lower"}
{"run":76,"commit":"f894e80","metric":3,"metrics":{"security_findings":0,"guidance_findings":3},"status":"discard","description":"Baseline for maintainer rerun-helper discoverability found that the architecture and script-maintainer docs still discuss raw chezmoi state markers without surfacing the managed one-script rerun helper.","timestamp":1776644664865,"segment":38,"confidence":null,"iterationTokens":102,"asi":{"hypothesis":"A small maintainer-doc pass can surface chezmoi-rerun-script in the places where maintainers learn about run_onchange state markers, improving recovery-path discoverability without changing behavior.","rollback_reason":"Baseline only; no repo changes beyond autoresearch instrumentation should be kept from this run.","next_action_hint":"Add concise chezmoi-rerun-script references to ARCHITECTURE.md, docs/architecture-and-performance.md, and the chezmoi-script-maintainer skill.","insight":"This is a low-risk improvement because the helper already exists and is already documented elsewhere; the gap is that the maintainer docs still imply direct state-marker handling is the only obvious recovery path."}}
{"run":77,"commit":"762c2cd","metric":0,"metrics":{"security_findings":0,"guidance_findings":0},"status":"keep","description":"Surface chezmoi-rerun-script in the maintainer-facing architecture and script-maintainer docs so state-marker guidance points to the sanctioned one-script rerun helper too.","timestamp":1776644702689,"segment":38,"confidence":null,"iterationTokens":1567,"asi":{"hypothesis":"A small maintainer-doc pass can make the run_onchange recovery helper easier to rediscover in the same places maintainers learn about state markers.","insight":"This closes the last obvious discoverability gap around state-marker recovery: once the helper exists and is documented for users, the maintainer docs should mention it anywhere they teach raw state tracking.","scope":"Touched only ARCHITECTURE.md, docs/architecture-and-performance.md, and private_dot_agents/private_skills/chezmoi-script-maintainer/SKILL.md.","validation":"The existing JSON parse, shell syntax, Neovim template parse, run_after harness checks, and targeted chezmoi dry-run validation all remained green.","best_practice":"If a repo standardizes a helper for invalidating one apply-time state entry, mention it in the maintainer docs that explain raw state markers so people do not jump straight to clearing the entire cache."}}
{"type":"config","name":"CLAUDE state-file guidance audit","metricName":"issue_count","metricUnit":"","bestDirection":"lower"}
{"run":78,"commit":"762c2cd","metric":2,"metrics":{"security_findings":0,"guidance_findings":2},"status":"discard","description":"Baseline for CLAUDE state-file guidance found that the operational note still points straight to clearing the whole state directory without distinguishing targeted reruns from full reruns.","timestamp":1776644781140,"segment":39,"confidence":null,"iterationTokens":101,"asi":{"hypothesis":"A one-line CLAUDE.md edit can steer maintainers toward chezmoi-rerun-script for one-script recovery while preserving the raw state-directory wipe for deliberate full reruns.","rollback_reason":"Baseline only; no repo changes beyond autoresearch instrumentation should be kept from this run.","next_action_hint":"Rewrite the CLAUDE.md state-files bullet to mention chezmoi-rerun-script first and reserve clearing ~/.cache/chezmoi-state for full reruns.","insight":"This is a better-than-cosmetic fix because the current wording nudges maintainers toward the broadest recovery action even though a narrower repo-managed helper exists."}}
{"run":79,"commit":"e521f9d","metric":0,"metrics":{"security_findings":0,"guidance_findings":0},"status":"keep","description":"Tighten CLAUDE.md's state-files note so it points to chezmoi-rerun-script for one-script recovery and reserves clearing ~/.cache/chezmoi-state for deliberate full reruns.","timestamp":1776644808201,"segment":39,"confidence":null,"iterationTokens":903,"asi":{"hypothesis":"A one-line CLAUDE.md edit can steer maintainers toward the narrower repo-managed recovery action without removing the broader full-rerun option.","insight":"This makes the operational note match the repo's actual ergonomics: a managed helper now exists for targeted invalidation, so the docs should not default to the broadest cache-clearing action.","scope":"Touched only CLAUDE.md.","validation":"The existing JSON parse, shell syntax, Neovim template parse, run_after harness checks, and targeted chezmoi dry-run validation all remained green.","best_practice":"When a repo has both targeted and broad recovery mechanisms for apply-time state, maintenance docs should recommend the narrow helper first and frame the broad cache wipe as the full-rerun option."}}
{"type":"config","name":"Legacy run_before comment audit","metricName":"issue_count","metricUnit":"","bestDirection":"lower"}
{"run":80,"commit":"e521f9d","metric":1,"metrics":{"security_findings":0,"guidance_findings":1},"status":"discard","description":"Baseline audit found one remaining stale legacy naming reference: the prefetch-assets script still says 'run_before_*' in a comment even though the repo now uses run_onchange_before_* for prereq scripts.","timestamp":1776644914599,"segment":40,"confidence":null,"iterationTokens":99,"asi":{"hypothesis":"A tiny comment fix can remove the last obvious stale pre-run_onchange naming reference from the targeted scan without changing behavior.","rollback_reason":"Baseline only; no repo changes beyond autoresearch instrumentation should be kept from this run.","next_action_hint":"Update the prefetch-assets comment to say run_onchange_before_* instead of run_before_*.","insight":"This is small, but it preserves the value of the earlier broader naming cleanup by preventing source comments from reintroducing the old mental model."}}
{"run":81,"commit":"58fdbfc","metric":0,"metrics":{"security_findings":0,"guidance_findings":0},"status":"keep","description":"Update the prefetch-assets script comment to use the current run_onchange_before_* naming so the last targeted legacy run_before_* reference no longer lingers in source comments.","timestamp":1776644939479,"segment":40,"confidence":null,"iterationTokens":872,"asi":{"hypothesis":"A one-word comment fix can finish the low-risk legacy naming cleanup by aligning the remaining source comment with the current run_onchange_before_* convention.","insight":"This is tiny but worthwhile because source comments are often the closest documentation while editing scripts; leaving the old term there would keep reintroducing the outdated mental model.","scope":"Touched only .chezmoiscripts/run_onchange_before_02-prefetch-assets.sh.tmpl.","validation":"The targeted audit cleared, the rendered script still parses, and the existing JSON/shell/Neovim/run_after harness checks plus targeted chezmoi dry-run validation all remained green.","best_practice":"When a repo completes a naming migration, finish the cleanup in nearby comments too so maintainers do not keep learning the deprecated terms from the source itself."}}
{"type":"config","name":"Bootstrap doc maintenance-wrapper symmetry audit","metricName":"issue_count","metricUnit":"","bestDirection":"lower"}
{"run":82,"commit":"58fdbfc","metric":1,"metrics":{"security_findings":0,"guidance_findings":1},"status":"discard","description":"Baseline for bootstrap doc maintenance-wrapper symmetry found one remaining intro-line mismatch: the section names czl but still omits the documented macOS sibling czm.","timestamp":1776645034011,"segment":41,"confidence":null,"iterationTokens":100,"asi":{"hypothesis":"A one-line docs/bootstrap-and-flags.md fix can align the update-helper section intro with the wrapper bullets below by naming both platform-specific maintenance wrappers.","rollback_reason":"Baseline only; no repo changes beyond autoresearch instrumentation should be kept from this run.","next_action_hint":"Add czm to the update-helper intro line in docs/bootstrap-and-flags.md.","insight":"This is small but useful because the section opener is the quick skim line; if it omits czm, readers can miss that the macOS path has an equally first-class wrapper."}}
{"run":83,"commit":"4d19ff8","metric":0,"metrics":{"security_findings":0,"guidance_findings":0},"status":"keep","description":"Add czm to the bootstrap-and-flags update-helper intro line so the quick skim text names both platform-specific maintenance wrappers instead of only czl.","timestamp":1776645058682,"segment":41,"confidence":null,"iterationTokens":812,"asi":{"hypothesis":"A one-line doc fix can make the bootstrap helper section opener match the wrapper bullets below and reduce platform-asymmetry in quick scans.","insight":"This matters more than the line count suggests because section-intro text acts like an index; if it lists only czl, readers can wrongly infer that the macOS path is secondary or absent.","scope":"Touched only docs/bootstrap-and-flags.md.","validation":"The targeted audit cleared and the existing JSON/shell/Neovim/run_after harness checks plus targeted chezmoi dry-run validation all remained green.","best_practice":"When a doc section introduces a command family in one sentence, include the full first-class set there instead of relying on lower bullets to reveal missing platform variants."}}
{"type":"config","name":"Update-helper library comment symmetry audit","metricName":"issue_count","metricUnit":"","bestDirection":"lower"}
{"run":84,"commit":"4d19ff8","metric":1,"metrics":{"security_findings":0,"guidance_findings":1},"status":"discard","description":"Baseline for update-helper library comment symmetry found one remaining header mismatch: the shared helper says it is for czu/czuf/czl even though czm also sources it.","timestamp":1776645163102,"segment":42,"confidence":null,"iterationTokens":100,"asi":{"hypothesis":"A tiny shared-library comment fix can make the source header accurately reflect all wrapper scripts that consume it, including czm.","rollback_reason":"Baseline only; no repo changes beyond autoresearch instrumentation should be kept from this run.","next_action_hint":"Update the first two comment lines in chezmoi-update-helpers.sh to include czm.","insight":"This is the same symmetry class as the recent doc fixes: comments at the top of shared helper files are quick orientation points, so they should not hide a first-class consumer."}}
{"run":85,"commit":"8251c23","metric":0,"metrics":{"security_findings":0,"guidance_findings":0},"status":"keep","description":"Update the shared chezmoi-update-helpers header comment to include czm so the file accurately lists every wrapper script that sources it.","timestamp":1776645192157,"segment":42,"confidence":null,"iterationTokens":863,"asi":{"hypothesis":"A two-line comment fix can make the shared update-helper header accurately reflect the current wrapper set without changing behavior.","insight":"These top-of-file comments function like local source maps; if they omit a first-class consumer like czm, they quietly bias future edits toward the wrong command set.","scope":"Touched only dot_local/private_lib/chezmoi-update-helpers.sh.","validation":"The targeted audit cleared and the existing JSON/shell/Neovim/run_after harness checks plus targeted chezmoi dry-run validation all remained green.","best_practice":"Keep shared-library header comments synchronized with the real consumer set so maintainers can trust the source itself as a quick orientation aid."}}
{"type":"config","name":"czm validation symmetry audit","metricName":"issue_count","metricUnit":"","bestDirection":"lower"}
{"run":86,"commit":"8251c23","metric":2,"metrics":{"security_findings":0,"guidance_findings":2},"status":"discard","description":"Baseline for czm validation symmetry found two remaining omissions: the managed helper audit still skips czm, and CI syntax validation still skips the czm entrypoint while checking sibling wrappers.","timestamp":1776645368305,"segment":43,"confidence":null,"iterationTokens":99,"asi":{"hypothesis":"A small validation pass can treat czm as a first-class managed wrapper in the same lightweight checks that already cover czu/czuf/czl.","rollback_reason":"Baseline only; no repo changes beyond autoresearch instrumentation should be kept from this run.","next_action_hint":"Add czm to the health-check helper loop and add bash -n dot_local/bin/executable_czm to managed-npm-safety.yml.","insight":"This is a principled follow-through on the earlier docs symmetry work: once czm is presented as a first-class wrapper, the repo should also validate it as one."}}
{"run":87,"commit":"65e2f87","metric":0,"metrics":{"security_findings":0,"guidance_findings":0},"status":"keep","description":"Add czm to the managed helper audit and CI shell-entrypoint syntax checks so the macOS maintenance wrapper gets the same lightweight validation coverage as sibling wrappers.","timestamp":1776645410884,"segment":43,"confidence":null,"iterationTokens":2014,"asi":{"hypothesis":"A tiny validation-symmetry pass can treat czm as a first-class wrapper in the same places already checking czu/czuf/czl.","insight":"This is a good follow-through after the earlier docs symmetry work: once users and maintainers are told czm is first-class, the repo's lightweight validation surfaces should reflect that claim too.","scope":"Touched only dot_local/bin/executable_chezmoi-health-check and .github/workflows/managed-npm-safety.yml.","validation":"The targeted audit cleared, shell syntax and template checks stayed green, the run_after harness checks still passed, and targeted chezmoi dry-run validation remained green.","best_practice":"When a repo exposes sibling platform wrappers as first-class commands, extend basic presence and syntax validation to all of them instead of letting one platform path drift out of routine checks."}}
{"type":"config","name":"Update-wrapper CI syntax coverage audit","metricName":"issue_count","metricUnit":"","bestDirection":"lower"}
{"run":88,"commit":"65e2f87","metric":2,"metrics":{"security_findings":0,"guidance_findings":2},"status":"discard","description":"Baseline for update-wrapper CI syntax coverage found that the workflow still skips the base update wrappers czu and czuf even after adding sibling coverage for czl and czm.","timestamp":1776645533242,"segment":44,"confidence":null,"iterationTokens":100,"asi":{"hypothesis":"A small CI syntax-check expansion can give all four managed update wrappers explicit shell-parse coverage, not just the maintenance variants.","rollback_reason":"Baseline only; no repo changes beyond autoresearch instrumentation should be kept from this run.","next_action_hint":"Add bash -n lines for dot_local/bin/executable_czu and dot_local/bin/executable_czuf in managed-npm-safety.yml.","insight":"This is a natural extension of the previous symmetry fix: if czl/czm are worth syntax-checking as entrypoints, the simpler czu/czuf wrappers should not be left uncovered."}}
{"run":89,"commit":"0a73ea9","metric":0,"metrics":{"security_findings":0,"guidance_findings":0},"status":"keep","description":"Add czu and czuf to the managed-npm-safety shell-entrypoint syntax checks so all four managed update wrappers now get explicit CI parse coverage.","timestamp":1776645571689,"segment":44,"confidence":null,"iterationTokens":917,"asi":{"hypothesis":"A tiny CI expansion can finish syntax-check coverage for the full managed update-wrapper family without changing runtime behavior.","insight":"This completes a coherent validation story for the wrapper family: the base update commands and the maintenance wrappers are now all syntax-checked in the same lightweight workflow.","scope":"Touched only .github/workflows/managed-npm-safety.yml.","validation":"The targeted audit cleared and the existing JSON/shell/Neovim/run_after harness checks plus targeted chezmoi dry-run validation all remained green.","best_practice":"When a repo has a small family of first-class wrapper entrypoints, keep the CI shell-parse step aligned with the full family instead of validating only the more complex variants."}}
{"type":"config","name":"Health-check helper-command coverage audit","metricName":"issue_count","metricUnit":"","bestDirection":"lower"}
{"run":90,"commit":"0a73ea9","metric":1,"metrics":{"security_findings":0,"guidance_findings":1},"status":"discard","description":"Baseline for health-check helper-command coverage found one remaining omission: chezmoi-health-check still doesn't verify the documented chezmoi-rerun-script helper command.","timestamp":1776645729164,"segment":45,"confidence":null,"iterationTokens":100,"asi":{"hypothesis":"A one-word extension to the managed-command loop can make the local health-check verify the targeted rerun helper alongside the other documented managed commands.","rollback_reason":"Baseline only; no repo changes beyond autoresearch instrumentation should be kept from this run.","next_action_hint":"Add chezmoi-rerun-script to the managed helper loop in dot_local/bin/executable_chezmoi-health-check.","insight":"Checking the rerun helper is a good fit for this command: it's a repo-managed recovery tool surfaced in the main docs, so local drift should include whether it is actually installed."}}
{"run":91,"commit":"b189264","metric":0,"metrics":{"security_findings":0,"guidance_findings":0},"status":"keep","description":"Add chezmoi-rerun-script to the health-check managed-command loop so the local drift audit verifies the documented run_onchange recovery helper too.","timestamp":1776645750932,"segment":45,"confidence":null,"iterationTokens":846,"asi":{"hypothesis":"A one-token helper-list extension can make chezmoi-health-check cover the repo's documented rerun helper without changing behavior beyond better drift detection.","insight":"This closes a practical validation gap: once the rerun helper became part of the normal recovery guidance, local audits should notice if the command is missing.","scope":"Touched only dot_local/bin/executable_chezmoi-health-check.","validation":"The targeted audit cleared and the existing JSON/shell/Neovim/run_after harness checks plus targeted chezmoi dry-run validation all remained green.","best_practice":"If a repo documents a managed recovery helper as part of standard maintenance workflow, include it in local command-availability audits instead of checking only the steady-state update commands."}}
{"type":"config","name":"Managed helper CI syntax coverage audit","metricName":"issue_count","metricUnit":"","bestDirection":"lower"}
